05u5qeM36BBjaF9lsOyar2, Joyner Lucas, Just Let Go
4LlNoNZflek4hZyZigCxpW, Phil Vassar, Just Another Day In Paradise
3ZdJffjzJWFimSQyxgGIxN, Nelly, Just A Dream - Main
4y1LsJpmMti1PfRQV9AWWe, Cyndi Lauper, Girls Just Want to Have Fun
6FRLCMO5TUHTexlWo8ym1W, Maroon 5, Girls Like You (feat. Cardi B)
6GzApXoBQiiAjak3tOQfV3, 5 Seconds of Summer, Lie To Me (feat. Julia Michaels)
2iUXsYOEPhVqEBwsqP70rE, 5 Seconds of Summer, Youngblood
11cDEev79fPKi6uJCjUhu8, The Chainsmokers, Who Do You Love (with 5 Seconds of Summer)
2j5hsQvApottzvTn4pFJWF, Maroon 5, What Lovers Do (feat. SZA)
11kDth1aKUEUMq9r1pqyds, Travis Scott, 5% TINT
6V1bu6o1Yo5ZXnsCJU8Ovk, Maroon 5, Girls Like You (feat. Cardi B)
55S2PQgSMYAhgoTCcGCDfw, 5 Seconds of Summer, Youngblood
78TTtXnFQPzwqlbtbwqN0y, Rihanna, FourFiveSeconds
2iuZJX9X9P0GKaE93xcPjk, Maroon 5, Sugar
27356GVuMPFWiJSZCragoM, Ariana Grande, make up
4kV4N9D1iKVxx1KLvtTpjS, Ariana Grande, break up with your girlfriend i'm bored
0QIjsbm2fh1cJ45XO9eGqq, Gucci Mane, Wake Up in the Sky
7wcyO1rrH3Ru4t659IjG41, Future, Crushed Up
0At2qAoaVjIwWNAqrscXli, Ella Mai, Boo'd Up
6yz0Jndhv0QjKdpcEMbOjz, Trippie Redd, Shake It Up
3BXXkwyhsHM0EPApHMhQC5, Gunna, Speed It Up
7jr3iPu4O4bTCVwLMbdU2i, Dua Lipa, Kiss and Make Up
2G1tXoGBaEMJ7FKGnkf6ud, Gucci Mane, Wake Up in the Sky
0PpfPNtQOOvbMNVJijTQj0, Pardison Fontaine, Backin' It Up (feat. Cardi B)
5OCJzvD7sykQEKHH7qAC3C, Ariana Grande, God is a woman
7GX5flRQZVHRAGd6B4TmDO, Lil Uzi Vert, XO TOUR Llif3
0b9oOr2ZgvyQu88wzixux9, Childish Gambino, This Is America
1ZAyjvIk9YiD76yYy0TEG6, Rich The Kid, Plug Walk
5EYi2rH4LYs6M21ZLOyQTx, Rex Orange County, Loving Is Easy
2VxeLyX666F8uXCJ0dZF8B, Lady Gaga, Shallow
2eAZfqOm4EnOF9VvN50Tyc, Lil Uzi Vert, The Way Life Goes (feat. Oh Wonder)
45aBsnKRWUzhwbcqOJLwfe, Keala Settle, This Is Me
34DFpyq5NJJ79GnGbbJH3p, Scotty McCreery, This Is It
6QfS2wq5sSC1xAJCQsTSlj, Lady Gaga, Shallow - Radio Edit
4kV4N9D1iKVxx1KLvtTpjS, Ariana Grande, break up with your girlfriend i'm bored
7iDa6hUg2VgEL1o1HjmfBn, Bebe Rexha, Meant to Be (feat. Florida Georgia Line)
0prNGof3XqfTvNDxHonvdK, Alessia Cara, Scars To Your Beautiful
4uhvMW7ly7tJil31YYscAN, Lil Uzi Vert, Erase Your Social
0nJW01T7XtvILxQgC5J7Wh, Bruno Mars, When I Was Your Man
74cVJfmK18rhWnscIpGXjt, Cardi B, Thru Your Phone
6wycnu8FWXsj68ig7BEot9, Keith Urban, Blue Ain't Your Color
2BgEsaKNfHUdlh97KmvFyo, Anne-Marie, 2002
3JvrhDOgAt6p7K8mDyZwRd, Vance Joy, Riptide
0utlOiJy2weVl9WTkcEWHy, J. Cole, Neighbors
7eBqSVxrzQZtK2mmgRG6lC, YNW Melly, Murder On My Mind
2yZax79pOrYuyIFVW2cZY2, XXXTENTACION, Carry On
2bSk87AVkCIIC3Bcligq1z, Lil Baby, Life Goes On
0SfG57HqtBNqKN9O27fo1s, Lil Pump, Racks on Racks
1I3ZAmPmbFV78oNKnibOiW, Future, Jumpin on a Jet
5274I4mUMnYczyeXkGDWZN, Future, Fine China
5rFj8OzffT0iggSjcBaeND, Sam Smith, Fire On Fire - From "Watership Down"
5AnSllIrgGsCZzZJkVnApx, Chase Rice, Eyes On You
2WfaOiMkCvy7F5fcp2zZ8L, a-ha, Take on Me
2BOqDYLOJBiMOXShCV1neZ, Calum Scott, Dancing On My Own
4T652DlATVHe0jdLKaN3Bw, Ariana Grande, in my head
2MShy1GSSgbmGUxADNIao5, Kodak Black, Calling My Spirit
7eBqSVxrzQZtK2mmgRG6lC, YNW Melly, Murder On My Mind
2G7V7zsVDxg1yRsu7Ew9RJ, Drake, In My Feelings
1RGasjWLZ4qMN7wbtkLa3u, Billie Eilish, my boy
5tAa8Uaqr4VvA3693mbIhU, Zara Larsson, Ruin My Life
4paAidoE8VAemwU4jgCc6l, 21 Savage, all my friends
2QZ7WLBE8h2y1Y5Fb8RYbH, Shawn Mendes, In My Blood
1tT55K6VEyO6XFDxK4lDQe, Peter Manos, In My Head
4MPTj8lMMvxLwT3EwuXFop, The Weeknd, Call Out My Name
04MLEeAMuV9IlHEsD8vF6A, French Montana, No Stylist
62vpWI1CHwFy7tMIcSStl8, J. Cole, No Role Modelz
2qT1uLXPVPzGgFOx4jtEuo, Ariana Grande, no tears left to cry
5WvAo7DNuPRmk4APhdPzi8, DJ Khaled, No Brainer
1KGi9sZVMeszgZOWivFpxs, TLC, No Scrubs
6OaVWaGfhXn70ZJfdVcabn, Travis Scott, NO BYSTANDERS
2Xqd0wUttjueBfdcltADOv, G-Eazy, No Limit
57IRaiAB4hBZu3gnNVZC0v, YoungBoy Never Broke Again, No Smoke
67iF3DdebmElASIGoebYt1, White Noise Meditation, Brown Noise - Loopable with No Fade
6M0IsaUX4GNyto4niSegfI, Post Malone, No Option
7jTL6K5hqWDVUH4j2thZrp, Quality Control, Movin’ Up
3wdfLVUhmX64lIyWIIEW8s, Quality Control, Ice Tray
49K3jbwZmZKaDGTfjpIVg0, Quality Control, My Dawg
0CjHqLvr4EdjBJ0XiKtbCI, Quality Control, Menace
1C8yDcVIhBObN58cSS8oX9, Quality Control, Bosses Don't Speak
4OnWIMfSOXvAdbBCRosqhS, Quality Control, She For Keeps
6rcKz2VYbcaHJ0qSXucR56, Quality Control, Too Hotty
6Eoz2eZzrDV0AhzJxfqkFg, Quality Control, We The Ones
4vNeJ6DoAlTPzoYO9W4mJH, DJ Drama, Wishing (feat. Chris Brown Skeme & Lyquin)
6XTetcNx1W6CKG0lSSnvrq, Quality Control, Um Yea
3eydp9rHJAskzOevEBK267, Los Unidades, E-Lo (feat. Jozzy)
0FZ4Dmg8jJJAPJnvBIzD9z, Kodak Black, ZEZE (feat. Travis Scott & Offset)
5wujBwqG7INdStqGd4tRMX, Juice WRLD, Armed And Dangerous
0d2iYfpKoM0QCKvcLCkBao, benny blanco, Eastside (with Halsey & Khalid)
6uSSupG4TMu3vW8QgynAB6, A Boogie Wit da Hoodie, Startender (feat. Offset and Tyga)
3KkXRkHbMCARz0aVfEt68P, Post Malone, Sunflower - Spider-Man: Into the Spider-Verse
2IoZOYOZDrWCOLoZoYedxQ, Gunna, One Call
285pBltuF7vW8TeWk8hdRR, Juice WRLD, Lucid Dreams
7dt6x5M1jzdTEt8oCbisTK, Post Malone, Better Now
4w8niZpiMy6qz1mntFA5uM, DJ Snake, Taki Taki (with Selena Gomez Ozuna & Cardi B)
3eydp9rHJAskzOevEBK267, Los Unidades, E-Lo (feat. Jozzy)
5wujBwqG7INdStqGd4tRMX, Juice WRLD, Armed And Dangerous
0FZ4Dmg8jJJAPJnvBIzD9z, Kodak Black, ZEZE (feat. Travis Scott & Offset)
6uSSupG4TMu3vW8QgynAB6, A Boogie Wit da Hoodie, Startender (feat. Offset and Tyga)
0d2iYfpKoM0QCKvcLCkBao, benny blanco, Eastside (with Halsey & Khalid)
3L19besdNQzd342qL78xqm, A Boogie Wit da Hoodie, Demons and Angels (feat. Juice WRLD)
3KkXRkHbMCARz0aVfEt68P, Post Malone, Sunflower - Spider-Man: Into the Spider-Verse
285pBltuF7vW8TeWk8hdRR, Juice WRLD, Lucid Dreams
7dt6x5M1jzdTEt8oCbisTK, Post Malone, Better Now
4w8niZpiMy6qz1mntFA5uM, DJ Snake, Taki Taki (with Selena Gomez Ozuna & Cardi B)
3KkXRkHbMCARz0aVfEt68P, Post Malone, Sunflower - Spider-Man: Into the Spider-Verse
14JzyD6FlBD5z0wV5P07YI, Billie Eilish, when the party's over
4VXIryQMWpIdGgYR4TrjT1, Juice WRLD, All Girls Are The Same
09IStsImFySgyp0pIQdqAc, Zedd, The Middle
79OEIr4J4FHV0O3KrhaXRb, Rich The Kid, Splashin
0rKtyWc8bvkriBthvHKY8d, Joji, SLOW DANCING IN THE DARK
4BiiOzZCrXEzHRLYcYFiD5, The Chainsmokers, Hope
6uSSupG4TMu3vW8QgynAB6, A Boogie Wit da Hoodie, Startender (feat. Offset and Tyga)
4NBTZtAt1F13VvlSKe6KTl, The Chainsmokers, This Feeling
2jt2WxXMCD4zjACthkJQVE, Eminem, The Ringer
45XhKYRRkyeqoW3teSOkCM, DJ Khaled, Wild Thoughts (feat. Rihanna & Bryson Tiller)
56TOfxnRzSRbFRw8J6C4IT, Josh A, Suicidal Thoughts
1AnoNTlYCt1ELWArtKsA4s, The Band CAMINO, My Thoughts on You
79VMlcpvgHkxz0xwsTfc9d, Mac Miller, Thoughts from a Balcony
5sCvipEhpAhVhu3K6kzm1P, The Band CAMINO, 2 / 14
00t7QTffOR3SA3L1BvSQVq, The Notorious B.I.G., Suicidal Thoughts
7DT8GwyRKluJhnl0BEOUA2, Galimatias, Pretty Thoughts
6BTra8Fue43w5lS1eEibvo, Set It Off, Midnight Thoughts
0rJzsc89WVFLnFEeksmOZO, Set It Off, Midnight Thoughts
22yRdwQ4OXUlPrLGhF6ebu, grandson, thoughts & prayers
4eubZoLt0CrH3xxhw4oa5B, Robyn, Send To Robin Immediately
4QnWMxwAkc9V2OlVPjG5mI, Tasha Cobbs Leonard, Immediately - Live
1QA5pcJHJMpn0ysGgVWsgd, Mystro, Immediately
24dGcvkFO6iPABJyfu4QLT, Tasha Cobbs Leonard, Immediately - Live
7mUsFoLCqTjcQzGFc2xBl3, Selling, You Can Have It Immediately
7K8ztY6ORNUpzVNxEyuZ94, Hamilton Leithauser, Immediately Alone
1GJxjkQf2SijdFgVn89hJS, Tasha Cobbs Leonard, Immediately - Live
5ePJZXZc0hIaHnXSEdyyOg, Mystro, Immediately
1BbSaioSUuk3qPhupB6iPp, Feats of Strength, Replace Immediately
3a4fkgat6iicV0hKMlYtm9, Gloss Gang, Immediately
4lr1FqhocDPtd6aAdFGRTN, Tee Grizzley, Factors
77DspvqBIMzg9cGifKUFGi, Ghost P, Tru Factors
05UGdq0zds3iZwfwrZ5NqV, The Tetris Kings, Deciding Factors
04vr5xjWJb3Uk4QatXAh6t, Alan Jackson, When The Love Factor's High
0QAo5fInizyQz9iX5uXqsp, Jeezy, Trap Or Die 2
0VY9GWnM8cOruKqtQZaRVi, Factors of 6, Gary Gets a Haircut
2RPMByfT52jl1hd8A0LcYo, Factors of 6, Masters of the Intro
4xmE7LwvP8SbsGY6rma18u, Factors of 6, End of the Debate
2JGugw2y4NJr1oARN88YDC, Factors of 6, It's a Repetition
3XsALkguQu08cm4ZHKzH4x, Factors of 6, Bedtime for Billy
3xzoXqypESowMIDPX760Ds, Alan Jackson, Drive (For Daddy Gene)
25leEEaz1gIpp7o21Fqyjo, Gene Autry, Here Comes Santa Claus (Right Down Santa Claus Lane)
1FV374EPG5CrjdIbIMLkcv, Alan Jackson, Drive (For Daddy Gene)
3jaUMGTyi4XHBZpXpIWzo2, Gene Ammons, My Romance
6Hy22YDN9HJMRlJP1LwnJy, Gene Chandler, Duke of Earl
38hbQ1wHHBNXDpPGJRMY28, Alan Jackson, Drive (For Daddy Gene)
1dtIaSlyrLI04sqYa8nLyN, Gene Autry, Rudolph the Red-Nosed Reindeer
3DgzTq5s4XJgikJgY0QWE5, Oliver Francis, Gene Simmons
3i8j2dKXChkErfi8jsDDuH, Gene Autry, Frosty the Snowman - 78rpm Version
4f4HLo6L9CJNhD4mEYxrCL, Gene Wilder, Pure Imagination - From "Willy Wonka & The Chocolate Factory" Soundtrack
4nVBt6MZDDP6tRVdQTgxJg, One Direction, Story of My Life
72C7aUQECOhNtnD0AC36ua, One Direction, They Don't Know About Us
5O2P9iiztwhomNh8xkR9lJ, One Direction, Night Changes
7kSLdGdXLey7pzLsWpdg1h, One Direction, Little Things
2K87XMYnUMqLcX3zvtAF4G, One Direction, Drag Me Down
3SPDQfj2UfWq6A2NllZnzn, One Direction, What Makes You Beautiful
2Bs4jQEGMycglOfWPBqrVG, One Direction, Steal My Girl
2afCBiru10AFckfOa49wIa, One Direction, You & I
3NLnwwAQbbFKcEcV8hDItk, One Direction, Perfect
0HMjXBAZmSYOTTi33WpMso, One Direction, History
5qaxeIJLARExwa34d9TuYp, Vanessa Hudgens, Sneakernight - Single Version
5SFlqyqDv89PO5JSWn2whs, Vanessa Hudgens, Amazed
0OLVsrE8s0bOF9di9WO7XZ, Vanessa Hudgens, Identified
3NfFNuvWeebgydVNO41slf, Vanessa Hudgens, Paper Cut
39Icu7L90hjrIjy7oCL9zT, Vanessa Hudgens, First Bad Habit
0TvFXLF4vmhqkDmHMK0UPW, Vanessa Hudgens, Don't Ask Why
4U1vdfpTLZmAM7gjQQM3gQ, Vanessa Hudgens, Hook It Up
2LjLbhxex8T9LcCLHrm2UA, Vanessa Hudgens, Did It Ever Cross Your Mind
4VhZOL7iS1aAq8tePEzx7v, Vanessa Hudgens, Don't Leave
6euu66avKlZQo1Eqb4niZ3, Vanessa Hudgens, Last Night
6V2D8Lls36APk0THDjBDfE, Drake, Started From the Bottom
3qK8x4GZcIkzTz9JEqvIF5, The Black Eyed Peas, Let's Get It Started - Spike Mix
2u1hMwcB9TwziV6P7jdyxX, P!nk, Get the Party Started
3qtZwBkPpK2Q8fcYRHm4AX, Frankie Ballard, It All Started with a Beer
4b0XF7CDpJEBAdVHMw7amV, James Otto, Just Got Started Lovin' You
1WtdhlaiUoDTrVNSwaya0L, Jason Aldean, Just Gettin' Started
3kG0GouWtUHNJJfEOgSwUn, Rickyxsan, Started
1ntrgXaJx0fi1gwxZXrqPg, Drake, Started From the Bottom
36CKza28wMxYdjdzji7ine, Bee Gees, I Started A Joke
4xh4WZodJ7NpFi7zKgiW3q, Georgia, Started Out
6nnSkEpzo8PmHsOlSopoO6, The Seeds, Can't Seem To Make You Mine
0AQj76XKZkJRbtnPL6RzSc, Solange, Some Things Never Seem To Fucking Work
7wwLxmUVLCfySaJ0fdyelI, Mindless Self Indulgence, Bitches
09RhTAi0nuzCs5KS2XWSs5, Mindless Self Indulgence, Faggot
3lv4SlmV5FnIbvQ1q7YLeA, The Menzingers, I Can't Seem To Tell
7JCzncOsHUjTUQcyC0iDHP, Trash Boat, How Selfish I Seem
6t90AyY9XvwRmsGcwQZm0j, The White Stripes, As Ugly As I Seem
6O0y6wES7YdtbgfR1ajoEM, Rags Cast, Things Aren't Always What They Seem
4uoPUH5GDt8GqgOglKV6u2, Brent Walsh, The Way You Seem
0XfmVOpqUrQwaxDbv4xwc0, Mike Birbiglia, You Seem Cool
6MQnGaWmh0CtXtAIAA4mN3, LDG Is LIKE, Don't Touch My Purp
3hnF1D5O7NfBICYdT2Wmkt, Derail Destiny, Affiliate
3FhdiPWtCD3DFmzpOKCT16, Affiliate, Change Your Mind - Original
0TMgtIDuyOdvp0nnYqQuct, The Pack, Booty Bounce Boppers - Main Version - Explicit
2DMAKzYG41v9reqoAwR0kD, Corleone, Affiliate
2A1FKyKfkrZQAB6bDMlgmm, Affiliate, Trash Bag Money remix
4m1y098z3v6emUESbMy7IT, Affiliate, Feelin'
1llFmgcOyMQlR1gnMVDlvh, Kobaryo, Affiliate Requiem
7iBaFSfVVvurm9ovBHNwVC, Affiliate, Night Shift - Original
01yi3rmsA1g0EnT4G4ie3z, Affiliate, Cold Shoulder
2ryA1BliGVycEEOAX5lYXD, Hannibal Buress, Teaching the kids about life - Live
5FzEeRc1LskfW3TUdGgRuC, Macklemore & Ryan Lewis, BomBom (feat. The Teaching)
0ncDj6MRGSX4uwy5iwkvN7, Ka$h Route, The Waves
0rZ28iJx4Z07NLmXsU1Rm3, Ka$h Route, No Time Outs
2Qb6IeCAOtzTJa1mFWCzvP, Macklemore & Ryan Lewis, BomBom (feat. The Teaching)
4K6sLiYChcQz1NXtQ4eHml, Macklemore & Ryan Lewis, BomBom - feat. The Teaching
6iWu4HeVjVFuY4tDOknMKc, Toddler Songs Kids, Icecream
55UWvqY16BWSAR7ddno5Qa, Toddler Songs Kids, Rainbow
4vtAwYJqhzwnHX4ccCTD1F, Toddler Songs Kids, Numbers Are Playing
2gPnaN25oB9Xuf7ZVc1j8h, Toddler Songs Kids, Chicken And Cow
7yoBjKO6cCnK3zV8gr1k4e, Highly Suspect, Lydia
1euszbbvkUzQzIhZUWFmXG, Highly Suspect, My Name Is Human
5y1jgbDNgTfxoWXv3FhH2Q, Highly Suspect, Little One
3FMZsyg0weeAzesHLC0sdU, The Motet, Highly Compatible
66Avcq6c51vcMGXLzHH5d7, Highly Suspect, Bloodfeather
2B6ZkjFk1vpqKlndTCvFas, Big Gigantic, Highly Possible (feat. Waka Flocka Flame)
252T5dAokvMiNzXZchojoH, Highly Suspect, Bath Salts
0aaOrTcwzvbTni3zUarEaT, Highly Suspect, Serotonia
1JcGNoiwifg0MdJMVgJQYx, The Vines, Get Free
2S7R4trL4HITPIfvKUxcA4, Highly Suspect, Wolf
2NBQmPrOEEjA8VbeWOQGxO, Snoop Dogg, Drop It Like It's Hot
61TklWcG8PbT5hvUTzwLaY, G-Eazy, Drop
7Ed6BkggCS2KaKY5YlINaF, BTS, MIC Drop (feat. Desiigner) [Steve Aoki Remix]
5JDcQAztvZTIkrWoZihgvC, Ron Pope, A Drop In The Ocean
2iDjCLUOGhJtz5cPHljGVd, Wiz Khalifa, Ass Drop
3e21cX0CVwzkQXiHz7WUQZ, Lil Wayne, Drop The World
150zGw0P2EJccYJKnFIler, Flume, Drop The Game
66PlhdEfyutLRYDVzJy9Rs, Gentle Rain Makers, Drip Drop Sleep
0qJ3YwgELCbYG4eKX7vCVT, Lil Gnar, Drop Top Benz
75scDPqGs75FotglJSoOI2, BTS, MIC Drop (Steve Aoki Remix) [Full Length Edition]
0pNN2pTU3uyaD6E4qQ8C9E, Ryan Stout, Reporting Information
7hb5W9rCXdf0tQAv1ggi1D, T. Bubba Bechtol, Eye Witness Reporting
1MZ0RZgDdXbSLO3MWmfXIy, Charles Bukowski, Charles Reporting
0QOZmxYwUlPrNpEIglfPRP, The Left, Reporting Live (feat. Guilty Simpson)
7MmSOGzA8C9IwTCATovcgt, Journalist 103, Dreamer
6f3YS4oBYZZQnpZXhu97AZ, Lil Raider, Reporting Live
3ym96bjxnJrX3rGjW1o7lw, Deajene Jones, OGC Reporting
5bluwjVqL36kp3YzeT0DRK, Danny Bensi, Reporting For Dinner
7EluOrorWooR72j876sQQN, Dennis McCarthy, Yesterday's Enterprise - "First Kiss"/"Not to Be"/"Empty Death"/"Reporting for Duty"
10xestMa55CZNQ09fGFAy8, Ray June, Reporting Live
5W46wGhH07gAk9IAgSRDXK, King Peezy, Accounts
2qKJd4aoOf6W31c2QM2uRF, Emery, By All Accounts (Today Was A Disaster)
5R1FmBqmLGSzMh9ufmbyMH, Outlast.Company, Accounts Big
6nDk77b0jGOdNaBDDMfai7, Among Savages, What Goes Around
1jebLPxiUzgVkr7W5CkyIT, Truxel, Household Accounts
4jUtk9xAFTNLNA1T71MS2Z, J Alive, Survive
4k7e7tI9PsYGbXahJsFexu, WDNG Crshrs, Accounts (feat. Cj Francis Iv)
2GOyYA6oZBiZ4qGabbErZI, Among Savages, If You See Her
14BQdjOjrAy04UXlljSDs2, Modern Life Is War, Hair Raising Accounts of Restless Ghosts (Aka Hell Is for Heroes Part II) - Remastered
50qNDkj9xjlffVoYWm54hd, J Alive, Know Me Now
4gbVRS8gloEluzf0GzDOFc, Maroon 5, Maps
2FtGF9wKcbAXsXlB2WTmxM, Maroon 5, Maps
0hDQV9X1Da5JrwhK8gu86p, Yeah Yeah Yeahs, Maps
5bsifWmUkQPnXXweW6Cx5u, The Front Bottoms, Maps
7ED8yT6oWUoq5WVIfaka4e, Colin & Caroline, Maps
3CK264UGtEvPpbvVEadVIP, Steve Petrunak, Maps (Instrumental Version)
2qStTBpso4X9ATqSpdMjq9, Freya Ridings, Maps
5cWSpmTfItDuppACMrE3I9, Message To Bears, You Are a Memory
75fKUcetc638W5uJVF3X7M, STRFKR, Maps
5A1YyOBJT9Xsc1IkJ7Mpfe, Kweku Collins, Oasis2: Maps
1lGagmYZPkqyB4bSzLm3e2, Maritime, Parade Of Punk Rock T-Shirts
3AQTwBJC02zedC45StmHw5, Zoogma, Jerry Diesel
6q0XsGDKFCCAzpdHkxAaLW, The Screaming Delilahs, Vehicles
1VDP9kpBG7nL6hAjTfKqVH, StoryBots, Drive A Truck
73e52XA37qqYWr2BtjluQD, StoryBots, Captain Of The Boat
72SQo2VeGIHfsGWYbb2JmV, StoryBots, Riding On A Train
7bWWMJblOIJgPqToaWckP7, StoryBots, Cars Cars Cars
3eKbCnVvVri9juiFWo330I, StoryBots, In An Airplane
1b2k0jS2ct7PdLxAYxtUUu, Athlete, El Salvador
6nM720F8XOg3bHUgYrryrs, Maritime, Tearing Up The Oxygen
12lZTPlXwUtrQuhEty6098, P!nk, Raise Your Glass
5NeIONQWJ25uPylJBJiO4c, Stone Sour, Through Glass
2BY7ALEWdloFHgQZG6VMLA, Looking Glass, Brandy (You're a Fine Girl)
5BoOzegGrg5XFRR8UBDtkF, Post Malone, Broken Whiskey Glass
1gk3FhAV07q9Jg77UxnVjX, Glass Animals, Gooey
4CcSw8wQAHYf4XNckayPoc, Annie Lennox, Walking on Broken Glass
76aadnUFFANRNDs6L3aqxw, Stone Sour, Through Glass
0P2fgmJp3a3PEu808hiQ1Y, Blondie, Heart Of Glass - Special Mix
1r1fPuhj9H4VdXr7OK6FL5, Linkin Park, CASTLE OF GLASS
0aersVHlGGXcHeRvHtuaSt, St. Lucia, Dancing On Glass
5kGThgtTAR9wi19xqEdsMj, Philanthrope, Amore Com Delore
3DOZrIy0OP3wtyDbJAALcu, Com Truise, Propagation
5M9kio8FEFiNKyTDGqksy2, Sleeping With Sirens, The Bomb Dot Com V2.0
0RBOFW5424gCCCZrgECbt6, Wesley Safadão, Romance Com Safadeza
4qatvTY4ntZeZyBWYLdKIk, Tycho, Awake - Com Truise Remix
0NAOAuBmmDOxy8Uk02D2so, Elis Regina, Só Tinha De Ser Com Você
7cFQFr1VpkSp3BTIn7X719, R. Kelly, Feelin' On Yo Booty
25jpX7KzuyCu8SZM0I4k47, Com Truise, Memory
3CwK0oEtu9bCl0R5nuMzjx, Com Truise, Cyanide Sisters
7sOqd1dVmfU5mgqrUtlqc5, R. Kelly, I Wish
1egU2OWYiTLJmV3cshqwrO, The Shins, A Comet Appears
5Z0GKdBhTmCsrIkM41DtRW, Trevor Morris, Floki Appears to Kill Athelstan
1Im0hrQEP8KkRI11YMeANn, Hillsong Chapel, His Glory Appears - Live
0ycGkIqmm8sdfTxtIOXc93, Yellowcard, What Appears
3mgdlG0AJUEzIj5U6ArlZA, David & Steve Gordon, Daybreak Appears
0a3mWRvQqI9nxzMjBjEpbu, Hillsong Worship, His Glory Appears - Live
40xyaQ3pjTIJ3OyQ7idC31, Evelyn Ida Morris, The Body Appears
0mcjp7typ1CcpSiycHZT2E, John Williams, The Princess Appears
6afmEZF1E0TnHiNUvUzPhH, Darlene Zschech, His Glory Appears
3psWpbEkxhWgFNtKq9CRK7, Matthew Perryman Jones, Save You
2TfSHkHiFO4gRztVIkggkE, Fall Out Boy, Sugar We're Goin Down
3YZE5qDV7u1ZD1gZc47ZeR, Kelly Clarkson, Underneath the Tree
1gGhqfs2pDTOI30AEXMXrn, Oliver Tree, Alien Boy
1Xls3QHvOQ7YLB54R6BvgG, Oliver Tree, Hurt
0a7BloCiNzLDD9qSQHh5m7, Fall Out Boy, Dance Dance
2EjXfH91m7f8HiJN1yQg97, Brenda Lee, Rockin' Around The Christmas Tree
1XBc4r6ltXjkFJBrsttwIF, Brenda Lee, Rockin' Around The Christmas Tree - Single Version
6wpGqhRvJGNNXwWlPmkMyO, U2, I Still Haven't Found What I'm Looking For
556l9P7WVZVyYUBjT1YFTT, Whethan, When I'm Down
5aJP0MZjb8LtPAT5WicCZm, Nat King Cole, The Happiest Christmas Tree
5Q5sQ1AgLQ1wKKXIYt6FGC, Lindsey Stirling, Elements
28jcFm1snS2T2CcnGladPy, TobyMac, The Elements
1L7HnGxcNdScMVnjc3XRK0, TobyMac, I just need U.
1cxM9XPSKofuSwbBwayZiG, TobyMac, Everything
6hEGx6C9gGvJQJM0D3yRuP, TobyMac, Starts With Me
3CO3Y3bI2EIXpY1m0oQUYw, Elements of Nature, Wet Water
5CYMOjWrVWZqHGv2ObF5mr, TobyMac, Scars
6j7oqmFB8mlCfmakwfQU1A, Kina Grannis, The Fire
6xYUVSUfBmitCFiHpCewUr, Sister Hazel, Elements III (Growin’ up)
54LFmUhSmkxUXXVQ7CngRh, Lindsey Stirling, Elements (Orchestral Verison)
6A7EPSz044QNtHDZejvezm, Binary One, Primary Contacts
6nm0hSPGUOJGSBcLeDlgFT, The Cure, Primary - Remastered Version
6Q6P0w0Cq8BxbujshtygHf, Primary, ~42
1MDuXjpO68UVjbBzrTL1Aq, MAGIC!, Red Dress
19vA9vjtcyFNDrGixsYozl, Primary, Bawling
6ss9pV5sKKYinhZAmIWhJe, Kari Faux, Gotta Know (feat. Jerry Paper)
39d5nUrDIg4y7pXEL4IbMa, Junggigo, Timeline (feat. Boi.B) (Prod. Primary)
5SSpHX29Gnzsv4ZN2ImYrx, Paul Cardall, I Love to See the Temple
6NwkAlnyJTL5mPAQuK3i36, The Horrors, Sea Within A Sea
40zMEUEKGYmE5Y6z63UHIJ, Sithu Aye, Primary Ignition
4Q3N4Ct4zCuIHuZ65E3BD4, Kodak Black, Tunnel Vision
2e6fCxto7NzsnujvliBtEk, Granular, White Noise - 700 hz
2eWqBNH136U8Et0UTxBacB, Granular, White Noise - BP 228 hz
0DcBQ7dMhCMvk9t6L4XI7G, JID, D/vision
4URQKHMxklDp1WQY0c6lZu, Kodak Black, Tunnel Vision
6xMHglHoafdDFGXS6qfwSH, Foreigner, Hot Blooded
0xzhryP1AoHUazYdJ5rj3B, Queen, One Vision - Remastered 2011
2QRk4N7GObZRGyhKjUHZhP, Turnover, Dizzy On the Comedown
0fsj3HxzBHev6EJ7OLFE3r, Foreigner, Double Vision
0gLQ6jhJsyYfl7PrD1RZ7X, Mariah Carey, Vision of Love
48Oewsngh2r6BmGd9XmTY0, Stereolab, Pack Yr Romantic Mind
5V0pOMBxjIQfhfLo1LTcIn, Aries Spears, No Announcements
3OZWs8UxrIWMnoP28I3ZQe, Stereolab, Tone Burst
7whh3jCH1El8p7M0V1DwHK, happytree, No Announcements
2gm8jfyH6jLtjnAqey6IV8, Vitamin String Quartet, Dánarfregnir Og Jarðarfarir (Death Announcements and Funerals)
7qSGZfxPD0JKB5BI12Y2jo, Joy Division, Leigh Festival Stage Announcements / Disorder - Live At Leigh Rock Festival '79
4zvDvWQ5zjOM0ZOVQpL5Z2, Rickey Smiley, Account Settled
5vUUk8J3DENArPuz9CcPBH, Stereolab, Jenny Ondioline
3Pckn4KNgcNFO59kUgcvRY, Johnny Cash, Opening Announcements from Hugh Cherry - Live at Folsom State Prison Folsom CA (1st Show) - January 1968
6AqTPvzFhp4EcaE4GGmvna, Bob & Doug McKenzie, School Announcements
7zdanauvITJaq9OE7bBz0c, Tyler The Creator, KEEP DA O'S
7aayLkoDFs4CLdi6zUNph1, Pouya, Pe$Os
1jBxLoNgHtZnY3ykT9MDyl, Kenia OS, Bonita
4UZ2iRGRcImqqric7KrDGR, Yann Tiersen, La valse des vieux os
5FSaP2dyursFVBRFtrMwIr, Jeremih, X's & O's
41Lq5z6ORoV0OkJRlMjgDF, Kenia OS, 11:11
0lGEWOZvMexZFXckBJxlVO, Os Mutantes, A Minha Menina
3nI0piSOxAik2RCpHGloB7, Charlie Brown Jr., Só os Loucos Sabem
3Z3cDIMrnPhIv0iCuhOqhY, Kenia OS, Kenia Roast Yourself
7aUQ20f49WmfU4gPcwp8f4, The Unicorns, Les Os
0Z2J91b2iTGLVTZC4fKgxf, 2Pac, Hit 'Em Up - Single Version
0gHcxtyWQT0HrlGxaxP1KT, NAV, Hit
61jnrkPHpLumBf1kqGpRRt, Post Malone, Hit This Hard
0vOkmmJEtjuFZDzrQSFzEE, Pat Benatar, Hit Me With Your Best Shot
2rwmKpWW6o6anOhvcyiJOw, Mack 10, Nothin' But The Cavi Hit
6ciLLh4TkPYDUfNxn2Z0KO, Selena Gomez & The Scene, Hit The Lights
5VYbLzAplnqPaGNpcf8qhZ, Linkin Park, Hit The Floor
4zYTZvtcww7OWKie7fxA9E, Blu Cantrell, Hit 'Em Up Style (Oops!) - Remix Radio Mix
4OjuzM3rTWp3q60mEldNSF, iLoveMemphis, Hit the Quan - Original Version
40TKWq5LzZCQWLFBOKTe1j, Tiny Meat Gang, Please Be A Hit
3utq2FgD1pkmIoaWfjXWAU, Billy Joel, Scenes from an Italian Restaurant
4OjKHySJHstsImlUW3qfml, Arlo Guthrie, Alice's Restaurant Massacree
2rhFaau65TFMv4mACtE9it, Billy Joel, Scenes from an Italian Restaurant
6UekvIeyqO9tsAKPTfDqCx, Background Sleep White Noise, Restaurant Chatter - Loopable
0MUZAcbdUHYqvMRzIVixqV, Aziz Ansari, Proposal Stories: "We Were at a 5 Star Restaurant."
6qBwmCd2cLd4O7uIGfvak1, Lee Jin-Ah, RUN
1VtBjpwh6xdRPDy20Uln3W, Jumbo, Siento Que...
5j14Xn8nJDcH9omZkBU4jP, Jumbo, Fotografía
4pYVwcwdWc0SaBeGpUbaja, Billy Joel, Scenes from an Italian Restaurant
0mdSOGzuqf84Yqs8RvBU4J, Drug Restaurant, Mistake
1jZRJKE7GZdiZzVgMS9mv2, Scott Bradlee's Postmodern Jukebox, All About That Bass
6Hxe9iKvXIvR1ZQ1o2KL7m, Scott Bradlee's Postmodern Jukebox, Rude
6i6Wi5CAYZUFiQr4dP2QPm, Josh Ritter, To the Dogs or Whoever
5fA2kD0tLcLcwLqvlSRwOh, Scott Bradlee's Postmodern Jukebox, Stay With Me
45IWFHuReTKymsYTLkDshI, Josh Ritter, The Temptation of Adam
7aPnwe4gtedBjnZ2HIvnOC, Scott Bradlee's Postmodern Jukebox, Really Don’t Care
734AOCJnNfjf6Dd7LjkVX3, Josh Ritter, Right Moves
7n1TZ3K6wWGxqvUXpM4tYG, Scott Bradlee's Postmodern Jukebox, Problem
5JwesasXdZNH9JQ0jMPdhd, Scott Bradlee's Postmodern Jukebox, No Diggity
4bhgcd3THvJE2RUKBAmya4, Rupert Gregson-Williams, Historical Footage
1ARJhjuI6TNYZCxYygFQ4F, Akon, Right Now (Na Na Na)
48t1aADyfDbDA3TzxqQHrN, Moneybagg Yo, Say Na (feat. J. Cole)
5maiP9UMnTSgoxPX8X3bdz, Trey Songz, Na Na
02LKuab9xcpE1dGc5Gd8iM, Anuel Aa, Na' Nuevo
5BB0Jzw60KyfSTyjJqtely, My Chemical Romance, Na Na Na [Na Na Na Na Na Na Na Na Na]
16fZpc0Md2q1SGu8FMTo6x, Miky Woodz, Na' Personal
5LIleJbUUgtvYnBW9wfY1W, Trey Songz, Na Na
2Jz1X6ZB0gkkCVgmeVGVGp, Angel Y Khriz, Na De Na
5V2AX2WTOHl2FKtftvisV6, This Band, Kahit Ayaw Mo Na
6v08G3CGcoyiODIWZoOxR4, Pentatonix, Na Na Na
5dpAN1mjFPL38kh9kWsCiw, Default, Wasting My Time
1k0FCgVwb1jZR57ESOWUVa, Default, It Only Hurts
6VUtGtohn02HzKuCFqu1yz, Default, Count on Me
2rbSoIg8MIfFiGcH1abcKD, Django Django, Default
6oKI26bh1VZcBe3SQNM2ZT, Default, Deny
2Fka5bMBcXzrrUHaJjpqGq, Band Of Skulls, Black Magic
7KphWfHFIvAWEV1opc5PMT, Iceboy Ben, Default Dance
1RXnyc0zTy3aDeUxmixsev, Atoms For Peace, Default
19YRtSdDo42mAd2FMp2pvl, Lil Memer, Default Dance
11mwI3nRWnx4BvyqB6ukUX, Default, The Memory Will Never Die
3EVgZBKWXY6xOtS8mrhW1C, Tigers Jaw, Follows
2FGMsHSG11DQkz579hd8X8, Waterparks, It Follows
69g3SU3gusPsvzTRprMWo5, Cane Hill, It Follows
3A4DmV53rkNt0GPUVHo7Ql, Jeff Williams, Like Morning Follows Night (feat. Casey Lee Williams & Lamar Hall)
0rhuzeJs3OHpPjvAsCB8rE, R.E.M., Sweetness Follows
0UTJVdT69Rz8cZlUzrlNbY, Dust Follows, Mountain Quail
3aR6jnYXOqm9zrW50NEeSW, Dust Follows, Baudo Guan
6GvyAwquB9ocJ1hbD6CyCB, Minor Threat, It Follows
0ZG9bCzYfPuJ4WWokzuJv0, David & Nicole Binion, My Soul Follows - Live
6emphM5lXkwEAxFKGhVOTR, Evans Blue, Dark That Follows
1ivuWgxFQb2xzxVNSlB1hF, Yellow Claw, DJ Turn It Up
67awxiNHNyjMXhVgsHuIrs, DJ Snake, Turn Down for What
5qBqBdfTEIWJwAS0Jm2F5R, The Byrds, Turn! Turn! Turn! (To Everything There Is a Season)
6mYrhCAGWzTdF8QnKuchXM, Cher, If I Could Turn Back Time
4KnnWpUyPfQD6X5SQSTlH3, Daniel Schulz, Turn Back Time
3aLWuWKHaTV4Ok7LKvXRYn, Cheat Codes, Let Me Hold You (Turn Me On)
11IJA30efHAJLO3qroPh5L, The Wombats, Turn
0RmXtDH1cBMGImRrmn5xL6, Kevin Lyttle, Turn Me On
6rjMQscV8vUrjKXAsU9hNi, Bob Seger, Turn The Page - Live In Detroit/1975
7HPhrbgMHV5cUskknWA2oo, Metallica, Turn The Page
1pKmfhwbZvsyYUP2eOGdw5, Twenty One Pilots, Screen
2eMVogxm08LgfgnWpahooV, John Mayer, Split Screen Sadness
0i4nHa7wLCX11M7yIp7iTJ, The Wonder Years, Passing Through A Screen Door
2KQ9Cqhyz8053sl9jjdjZD, 5 Seconds of Summer, Heartache On The Big Screen
2BrJD5vKA2nv5fqBTqkPlZ, John Prine, Knockin' on Your Screen Door
6JyGk2O6Mb1dNG474bJf77, John Maus, The Combine
1WTbOb9bzd2Ym3xh0ZPzZ4, New Found Glory, Kiss Me
1BI3XSjk5qZUwJRfg1rmOo, Trifect, Screen Love (Feat. Slyleaf & Bien)
3wW7zPGR3IZiYLhonu5NWp, Rick Clark, Breaking Through
7nUsDCJPnJTqNUqxipnNy4, Vince Staples, Screen Door
2s1sdSqGcKxpPr5lCl7jAV, Sia, Chandelier
5S9lfZu1YF8xKkgSsqL2Bd, Sia, Elastic Heart
7zE6pyXLjUCOy8PG0UL5SZ, Sia, Big Girls Cry
0udoMICxzaUbNUT8EVRq8B, Sia, Elastic Heart - Piano Version
2akkzRZ5HADuMZ03TlyxSR, Sia, Fire Meet Gasoline
2s9M78CDrQDjB2D827XXr4, The Naked And Famous, Higher
6H8UxS43KArEIu2vGZI9Dj, Sia, Eye of the Needle
0Ha4WnjeGxmsnzTnlEvjvZ, Sia, Chandelier - Piano Version
3rQ0mHb3F9cMo86DLZphUE, Sia, Burn the Pages
4SxoponB2oxqjuOSNYhTjb, Bonobo, All In Forms
5lJAZ8IMBzfeWcV3PjCMMO, Tyga, Leather in The Rain (feat. Kyndall)
4IJ7ZoJ8z8cAIbqYShF3ZZ, Drake, Tuscan Leather
