54MXF9I8s3DuiQo3g0gZ5k, Pierce The Veil, A Match Into Water
3AMTGul9vVdb08KK6LyhLr, Xavier Wulf, Match Hunters (feat. Madeintyo)
7xwH7ff9hllhk9N2jdO0Jt, Architects, A Match Made In Heaven
5OnchRw2yAuIAwp2RYLCBa, LOOΠΔ / ODD EYE CIRCLE, Girl Front
5fgpCIjBJ098E9zqN9DS87, LOOΠΔ / ODD EYE CIRCLE, Sweet Crazy Love
4aL5x9pzbU5PTLca3oJjo3, John Williams, The Quidditch Match
5uDFIUrj3WjmgpSs2Zxc4d, TobyMac, Like A Match
0ZsRFf3jsn4MvGHUoIcKLy, LOOΠΔ / ODD EYE CIRCLE, ODD Front
2oFbMd0TcgUm7Df4Sx16h9, LOOΠΔ / ODD EYE CIRCLE, Uncover
3bbgGl4bARTmgOp64bJet0, You Blew It!, Match & Tinder
2ReIKou3TSCtWLrTL7D4OR, Scar Symmetry, Children Of The Integrated Circuit - instrumental
3fZOJZ7M6Euldiepqx73kE, Betamaxx, Integrated Circuitry
3EPMeFpu2p7xK5uzA88UQu, OmenXIII, Integrated
55ugnR3YX7CDHGawqX9kMD, Betamaxx, Integrated Circuitry
1EhNBTBetnJ8s45ItX9W0y, Dodecahedron, Queued
7s14L1A6ZpsBVsCRVTJyL2, Dodecahedron, Glacier
56wvEmQWTafvJn2I2rqnHf, Dodecahedron, Hotel
05NqEGsexMKHTcOZMqrKY0, Dodecahedron, Glacier
4I8CdWDDlY5IdmG15yaRpe, Dodecahedron, Queued
5YplXxIR061yqjE6vn2EaK, Dodecahedron, Hotel
1ztg7aCm5JfkID4jwcpNGG, Skibo Deebo, Bo$$ Chick
1nkRKWTl27PExyHv7hCzQ4, Skibo Deebo, Im On
7bB5D0CvGa5Y03neLtRx0R, Joywave, Facility (feat. Sts)
5IjxHizm1zWbuedFr0yBJB, SEGA SOUND TEAM, Eggman's Facility - Rhythm and Balance Remix
49uHD52UmB7XU40a7K9LwD, 20 - Bit Dream, Goldeneye 64 - Facility
0rSyppNl51hSqbxnPG5Kqu, The Band Of Heathens, Rehab Facility
23rvrbogSpvFmixFh20QC9, Skitstövel, Facility Window
43dazanWx9KvGCs4jcqbtE, Sleep Research Facility, 79ºs 83ºw
41DTFRxRkSe2FOdwRbIVZr, NxxxxxS, + hi tech research facility +
5RllH4EtLiSWmLmSn0cBN5, Soft Cell, Facility Girls
0Ui8KPWZbJJQ2Y0CIQuVqX, The Beatles, Paperback Writer - Remastered 2015
4401c08DdNwwGEg8WGCkQf, The Beatles, Paperback Writer - Remastered 2009
3OtsmzTZs50ahEnHKVvozC, The Beatles, Paperback Writer - Remastered 2009
0qAWDqss1wV94QMxWzhn8n, The Lil Smokies, Paperback Writer
5yvTS7OZWzXDjf7K3TdvT3, The Last Sleepless City, Paperback
7sOzdE9XBGRtwjaEzN2abw, Tegan and Sara, Paperback Head
7vZDqkR907O6tNSUexacBT, Ali Morgan, Paperback Boy (Select Mix Remix)
0YLDVlDrPM0HNuBSIn4RAn, The Beat Bugs, Paperback Writer
0umvSqhy0BcXyQhhwkULxU, Ali Morgan, Paperback Boy
3UyNeWkKOwzFmZsTP0Yry6, Envy On The Coast, Paperback
2RycgtfFQZOPgEGrzBGE0j, quickly quickly, Getsomerest/sleepwell
0LWlhQwduzn48itDPT2yY8, quickly quickly, Swingtheory
4jUTKYm8WUK3nUox8UuAau, SwuM, this again..
35qlk8sTjO4xHAVilmMjli, quickly quickly, Blingblingbling
1DryFlz9GE3GM1FneruABy, quickly quickly, gorge
2lL1mdmCo6LsO2JAKoFRw4, quickly quickly, Lie
003jyCDLi9dKQcnsdzy64K, Braxton Cook, Never Thought (Quickly Quickly Remix)
7rmRcT3iunktA6GxiEzNci, Rain Sounds, Fall Asleep Quickly
13V5eeEBRaXw0B50NeUCiH, quickly quickly, Stilted - Intro
0xTMio7Cd92KKIBa9tg9fw, Spa, Fall Asleep Quickly
15lnoO7DPxUcasFNaQXscw, Nawab, Expert Jatt
6etGPWtu2q0ANPRon94ckw, Sure Sure, The Expert
1Xrtt3AO3NC46CgTQtr3Es, FFA, Expert in Love
4JFJkPh30jmBW6hMaeSZo3, Palm, Walkie Talkie
6LDW240k4pHiVUBiTtkrnb, BIJOU, Expert
5R2YDhBrch01VME5THr1R6, Palm, Shadow Expert
2vVwArQ9VrWw4uz8gxCRjH, Great Grandpa, Expert Eraser
2KsZZH4qT31lq8WJMzAVkZ, Mogwai, Thank You Space Expert
20uUHYtsceBzJEfCzfdSR6, Dan Cummins, Sasquatch Expert Serial Killer
3NRiuXFBvTQxg3MzXlznHw, Michael Ian Black, Day Job
2OvV4NjEBRE9v8Oo7QeUCq, Julia Michaels, Jump (with Trippie Redd)
7N3PAbqfTjSEU1edb2tY8j, Van Halen, Jump - 2015 Remastered Version
1jQsKN68yE94tMYml0wHMd, Big Sean, Jump Out The Window
3TZwjdclvWt7iPJUnMpgcs, House Of Pain, Jump Around
27AHAtAirQapVldIm4c9ZX, Kris Kross, Jump
1zW2csx1vVJrKfvDrFQNVt, Harry Belafonte, Jump in the Line
69ZNzwrCGP6h5ewkJQWWaT, Brad Kane, One Jump Ahead - From "Aladdin"/Soundtrack Version
7uhniEFBcLsYD4W92E0Nx2, Mac Miller, Jump
51gbF0SxTmxgAguiWWUXPu, Lupe Fiasco, Jump (feat. Gizzle)
17AS0y6FnHdYImAPUydAJg, Meek Mill, Jump Out the Face (feat. Future)
3NseyNkA2zbT2HaSqAzccz, Gung Who, The Recommended
7GGhSProewunlulwLnwFPD, Helen Baylor, Highly Recommended
3tvEsLDT1iRWABeHB87GbR, #Trending, Blood in the Water
6flsDrNt6DKU5qFyAH3ZPc, #Trending, Never Going Back
226U5XGJ9Ira07fMsNkaPg, #Trending, Click Bait
7nlEyXbvUm2CPPrj1mBIh6, #Trending, Moonshine
4j881mT2t78nGbjBdU6c7k, #Trending, Mother Fucking Princess
4QwIViEo6FwGdbkMqKP7CB, David Allan Coe, A Harley Someday
7lrCNwrpLLleUwuJGB7AeV, Helen Baylor, Highly Recommended
0nxczrmakHXvtcv6UpFOt3, David Allan Coe, Drink My Wife Away
6sbP2ku2EPDBfVlt5ggO6h, PRETTYMUCH, Teacher
1WOBzx0R3hyphrI1AUv4Zu, Lily James, When I Kissed The Teacher
6QDbGdbJ57Mtkflsg42WV5, Van Halen, Hot For Teacher - 2015 Remastered Version
06ljYcff5JwsDM19pcs1vo, Montana of 300, Favorite Teacher
39J9gLwAyM6n2c2vFVVvdV, Nick Jonas, Teacher
4RZDQ6jEPLt9N91scevCj0, Jinjer, Teacher Teacher!
21aMSP1Q1qKpixpgXaalAS, ABBA, When I Kissed The Teacher
1e75rLMvgoIGX5wnwUA7q0, Jethro Tull, Teacher
3UOFrelbGLUWJpRRzH3hbZ, The Last Samurai, A Hard Teacher
4xcTLkigmsLaIQAIewY9Fj, JZAC, Teacher Teacher
7tGEAA1f8MydT7eVbbO9Zy, Billie Eilish, WHEN I WAS OLDER - Music Inspired By The Film ROMA
3kywzyEr7V106Un5cDyh12, Sasha Sloan, Older
7FCYixd46BlSiO2memrsPo, Damien Rice, Older Chests
1OppUXF0ZsVATRbEyHOTyA, Imagine Dragons, Cha-Ching (Till We Grow Older)
0bkNJm3BcQyHpytMI7a3TX, Parcels, Older
3cHzrMhfYJOItIZd0kPVUR, Alan Jackson, The Older I Get
4NOZKKJKMWhQCe5uyQNNG6, Wild Party, When I Get Older
6SaeXxdt0Id6ZzmX0ZGTQK, George Michael, Fastlove Pt. 1
61N3CssJfDd8d4JJlGtqGL, Skillet, The Older I Get
2SzCxX6M6vDwdEwnHDiTaY, George Michael, Jesus to a Child
69uxyAqqPIsUyTO8txoP2M, Coldplay, Adventure of a Lifetime
2uuTo18bRgXj3RvlbZKMvU, Angels & Airwaves, The Adventure
283LAlCpfArRZOXPfkOQj0, Flight Facilities, Crave You - Adventure Club Remix
4c2R6y2TjvspDl1vU1Et7L, Ski Mask The Slump God, Adventure Time
6D1kEYqdY4D3okAOfeKouI, Adventure Club, Limitless (feat. Delaney Jane)
4PTPZeJlK1rYlYr6bf11hk, Madeon, You're On (feat. Kyan)
3RJuptH9QoeJWzHd4ZCI0u, Yuna, Lullabies - Adventure Club Remix
1tBNhMZ8kxr6XeIl191t3S, Coda, Fighting Gold (From JoJo’s Bizarre Adventure – Golden Wind) - English Version
7kh8PFSxaQ74UfdCFlsVC3, Adventure Club, MakeDamnSure
3NAGKEkJN7cUTaIYqFnF8l, Adventure Club, Crash 2.0
1I9GllIh1R3EMvTFT5Tfn7, Bruno Major, Fair-Weather Friend
1Pyxh8ERS8aouSSOQVvVsz, Bryce Vine, Sour Patch Kids
6hzbRKhJHo6cfCHSnNaDS8, Mac Miller, God Is Fair Sexy Nasty (feat. Kendrick Lamar)
2vi7FYjJUARm2ywcXVaLII, Flipp Dinero, Play Fair
5DJNyvuMmZfsfvdTpMMmUq, Bryce Vine, Sour Patch Kids
7KaYmeRaVDBzRmYoiKaiev, Neffex, It's Just Not Fair
5UDoMj8EIEXrQ4N0UR0nos, John Prine, Clay Pigeons
4T6p9mFEP9J1HbQWfdIP6F, Bryce Vine, Guilty Pleasure
53uzBMME2GSfpUVtOtiLvA, Simon & Garfunkel, Scarborough Fair / Canticle
3X3p3u03P8eFL8WTH0oaaU, Art Farmer, Fair Weather - Remastered
7hzZESy7YRonXwgiV62hX2, Burl Ives, Rudolph The Red Nosed Reindeer
0JXSi46jgn17CpDT6haz2O, Traditional, Deep River (Arr. Coleridge-Taylor Kanneh-Mason)
7FOJKfiyl1tegmYRqs7AuZ, Traditional, We Wish You a Merry Christmas / End Title - Voice
3MBZtdzEjtDZXkgGemFTFC, Anton Heiller, Seele Christi heilige mich
0p4vglytdqTyFC5EfBZDIZ, Christopher David Wiggins, Laetare Jerusalem
7vo68jtKg5i5BbQvnbZb2N, Matthew Brown, O magnum mysterium
1U4KP71Qy81GrKYQshSlAv, Anton Heiller, Missa in lydisch zum Weihnachtsfest: 2. Gloria
3st2SAaXm6GnnDlPtrf63a, Anton Heiller, Missa in lydisch zum Weihnachtsfest: 3. Sanctus
4ucsSahUTNS5guGGF8DYlS, Heinrich Kaminski, Psalm 130 Aus der Tiefe rufe ich Herr zu dir!
1xHPhpExF5qB1JI8QPtuJd, Anton Heiller, Missa in lydisch zum Weihnachtsfest: 4. Benedictus
6PFoEnjp0PAe5siGswjH9i, Panic! At The Disco, Dancing's Not A Crime
5IMtdHjJ1OtkxbGe4zfUxQ, Rupert Holmes, Escape (The Pina Colada Song)
05OCY605lOXP7koHNBMPc2, VAX, Crime
4oaU0fMSg3n9kqOwmLPVhH, Set It Off, Partners in Crime (feat. Ash Costello)
1tA9cQEtQPvUdcndCUcP9E, Lil Dicky, White Crime
0RZXNlGPvfMo54fd6uCvAT, Crime Mob, Knuck If You Buck (feat. Lil' Scrappy)
6qTF7EjSSecc1rip7xckgN, Connie Han, Pretty Women
4YsnD5GTI8nVBUXkmlqur4, Pop Evil, A Crime To Remember
3lOok0REf4j3790abX26PR, Chaos Chaos, Do You Feel It?
3msjDgdfwJ0Qcv2tXoisNN, Real Estate, Crime
5gFGKEHPMptVJppijRpjQF, Kate Bollinger, Tests
0B3CZlYaVRzTpAqfFoV4my, Into The Great Divide, Chapter 4: Tests & Enemies
4sG33FGu18On8jJxHCGfcy, Gibi ASMR, Check Up & Trigger Tests
0YfbpkSrFlh5sCwnEcHpnX, Black Night Numbers, Tests
3WxXNJMKzsQihz6aMzbDjN, Jellybean Green ASMR, Reflex Tests (part 2)
7qZyHrvyQgwYIAPCskQHBc, Jellybean Green ASMR, Reflex Tests
6mpzpdlfOQuHVh4l1YjulD, Mychael Danna, More Tests to Run
2nUqXAlMSrBdbcf22tkZeJ, The Microphones, Oh Anna
4SkYWk8SK8ZEnBK4KUNdu9, Jellybean Green ASMR, Reflex Tests (part 3)
0XdR3cvNUXEwxk0mWv2jKz, Mike Baldwin, Roadside Sobriety Tests
4at3d5QWnlibMVN75ECDrp, 6LACK, Pretty Little Fears (feat. J. Cole)
0KyAGiNGUytG5JLxJu4F6l, Clairo, Pretty Girl
2lf3fWzNhL5518BVE9iUlt, Florida Georgia Line, Sittin’ Pretty
1NDxZ7cFAo481dtYWdrUnR, Maggie Lindemann, Pretty Girl - Cheat Codes X CADE Remix
6H0AwSQ20mo62jGlPGB8S6, 2 Chainz, It's A Vibe
0EGuSSpuu9wmHCtvb4PdLO, Daya, Sit Still Look Pretty
66pxmg3Jhjm09tHoWR1wVR, Kenny Chesney, All the Pretty Girls
5lA3pwMkBdd24StM90QrNR, Michael Jackson, P.Y.T. (Pretty Young Thing)
2zOWuWdyuMqOoboNRKlJO0, Soulja Boy, Pretty Boy Swag
1nX9KhK3Fff27SnrIor2Yb, 2 Chainz, 4 AM
23oxJmDc1V9uLUSmN2LIvx, Yellowcard, Ocean Avenue
3hAGmPnGix8RTb1vy5qZcb, H.E.R., Avenue
2ofOe2OaXFpZF5ETbsc7Qu, Ariana Grande, Honeymoon Avenue
5SmXEPnevlRjBPWBG7oKIi, Ariana Grande, Honeymoon Avenue
0gZp88SA5OcujHLDGkxtI3, Yellowcard, Only One
0DKNNR9iDjwfCEpMiFXMJq, Story Of The Year, Until the Day I Die
7GoQWKoZbTH0bs5gSBihYF, INTERCOM, Decoy World (feat. Park Avenue)
0pAPFaE1Iwfvex9EVJuQlG, Tenth Avenue North, Control (Somehow You Want Me)
1qEyqHR1xsj2MC4Qy0dsaI, The Wallflowers, 6th Avenue Heartache
38paDDziQ57k1f4VfKTeGk, Billy Bragg, California Stars
6X5LE0sWOboyReUmlE3fSM, Gentle Whispering, Samsung S9 Unboxing Asmr
0PNn5VWOd90GXDqdltPhP3, ZENE THE ZILLA, SAMSUNG
2VvV5w6oTybLoO9pcRpgTz, Friðrik Dór, Hata að hafa þig ekki hér (SAMSUNG SESSJÓN)
28lzo95nuwSgi7P1aeQEZE, ManMan Badaxx, Samsung
0HUJLN3u6W09Xq4JGwTYTD, Jay Edit, On a Samsung
1f3bJ65j0L4QG5q2Oq5PWL, Tipe, iPhone Nokia & Samsung
3grjxqYfnrxpmNg38rTwuo, Emrys, Samsung
0WhsnqHeJdqSLu7lYWdsef, FrankoBrel, Samsung Ace
1cBCBPZ3qLSLRrcsbcwV2s, Lmao Guru, pressure
7M1ynxVw6umkKIzgFQAxED, Nathan Macintosh, Samsung vs Apple
6iF5JgF1GNUQwlnsgnMzUu, Tee Grizzley, No Effort
0okSg0Fu05g82l6CQQMNBx, Michael Salvatori, One Final Effort
5u1GVHrK9N8mBuyGJNMHOO, Jay Som, White Flag
4lXNONp7ICX7r2NDEPk7s2, Papithbk, Lost Effort
01w1IdzXfNmu033rWe4XrT, NOFX, I Don't Like Me Anymore
5HHR8lHtLowKzMavnA6GyW, NOFX, Six Years on Dope
3q81uuMbxNCZ3QrgR1BqE2, Martin O'Donnell, Halo 3: One Final Effort
0jJAEoWFh5TGSqbQpQZFVt, James Spaite, Effort
7hyjRG8PLrQk8bntQxIBr0, Tee Grizzley, No Effort
05kF2zJNlMyHGt6E0Adkn9, NOFX, Oxy Moronic
6uW03WHG3qv2FzxPIW6SUP, Cheryl Freeman, The Gospel Truth I / Main Titles - Hercules
0mHayzmzEB485RkUCETcCL, Daft Punk, TRON Legacy (End Titles) - From "TRON: Legacy"/Score
4y0Lt1KOuyhKGkGKFZjSlS, Hans Zimmer, Opening Titles
1LcNtS9B22LgIHxd9gTGcV, Michael Kamen, Main Titles from the HBO Miniseries Band of Brothers - Instrumental
48nnRcGWEO5ySlqE17tBYB, Ramin Djawadi, Main Titles
6t9O3rGBxgFsdbIvCBtZu5, Rachel Portman, Main Titles
6baN5nSUIVTsUyugSuAj7U, Vangelis, Main Titles - From "Blade Runner"
6sIZFWgScdBoCzEuo3H4pE, Michael Giacchino, Up With Titles
5YItelunJdgQncp9TOZiCH, Red City Radio, Two Notes Shy of an Octave
2IJJszwGK4NWmh3bNK6CPD, Ennio Morricone, The Good The Bad and the Ugly (From "The Good the Bad and the Ugly") - Titles
7jZHUhAmW5oq1cq6s8IxmK, ODESZA, Sun Models (feat. Madelyn Grant)
0uLijBRekQsSPwHs1LIEXz, Mr Jukes, Grant Green
5opJDyTf8jDn1TdQhQjAJK, JAG, Look What I Got (feat. Nick Grant)
2sHDB7pY43GVTsl0X3ob1B, Natalie Grant, King Of The World
0AiQLGevpr9XOc9kIRjyuB, Natalie Grant, Isn't He (This Jesus) [feat. Natalie Grant]
1jgOnCDCEq7fKGCjZwCRmZ, Natalie Grant, More Than Anything
7osb1eYuVpKsKJDMe6bodj, Grant Gustin, Runnin’ Home to You
0y50PSpOcYLOYrc0Xgw67R, David Hohme, Soft Landing - Jody Wisternoff & James Grant Remix
3Ctn2xJw2UVONr3FiG5fgy, bbno$, thankful
3IDsegNBHC4pjGCOMTQYlU, Amy Grant, Baby Baby
2P3SLxeQHPqh8qKB6gtJY2, Kendrick Lamar, Poetic Justice
0LAcM6I7ijW4VVW0aytl1t, Metallica, One (Remastered)
2jWBH2mvHuisHxhpDbHSXP, Five Finger Death Punch, Sham Pain
33yAEqzKXexYM3WlOYtTfQ, Justice, D.A.N.C.E
3zitROnY6trnTMyznT81yT, Five Finger Death Punch, Blue on Black
1zCi4cVFqe6ja16MeGZKRN, Kendrick Lamar, Poetic Justice
1T20tqHKrePjszGOdbFOEd, Victorious Cast, Take A Hint
116kG9vvdUtoprjYtToONt, Victorious Cast, Beggin' On Your Knees
0ep7UTGw3F9VkN9FV52En3, Metallica, ...And Justice for All (Remastered)
2gdCDdmwDEh77IxUcSTGNs, Five Finger Death Punch, When the Seasons Change
17cwqWxSyZK4bo7Hg7z9ko, Lomelda, Columbia River
76Mqk0Qz7x464IFWp74ZWr, The Blinders, I Can't Breathe Blues
7in3GxNPphXDq1Mcm586el, Young Scooter, Columbia Remix (Dirty)
605ZHoLZx7PtQ8fXgvN10K, Peter Tosh, Legalize It
5rBUuAPGWc6ldmatX7XpUH, Frank Sinatra, If You Are But A Dream (with The Bobby Tucker Singers)
41CHb7F7SXcmkj0h8wekeF, Billie Holiday, Gloomy Sunday (with Teddy Wilson & His Orchestra) - Take 1
4BH8EuPAxeFAh1rSWtnGdD, Tony Bennett, Rags to Riches - Remastered
1LGqJ3nvxpVXDWpEzq4DJD, Billie Holiday, All of Me (with Eddie Heywood & His Orchestra)
3BC6oQ1YD8C5gugymm25Xt, August Wilhelmsson, Columbia RD
5ZG1JwCKyUWBRizunThX1i, Frank Sinatra, All Through The Day
0IWDwptWv6pedeAyaSW85t, Brian Tyler, The Firm
04lSrPCYId76ftPqmKg53n, Julie Yardley, Even When You're Broken
4C0cgvQBKzgQpwmy5efnjE, Popcaan, Firm and Strong
0RslgVCtc9FCHd6z83YPkB, The Firm, Radioactive
5ucGKPzv8fnJ5kA8JJQoES, AZ, Firm Fiasco
2S4vZbC5zdTd7tURXvpVnd, Tori Harper, Stand Firm
4aRohZe8XySZqk8fYYrvIW, Lil Man, Firm Down
18GH1wnhYSg2o3M5T6gcVT, Norton Hall Band, How Firm a Foundation
2tHA8Z3oj4KUwqkJr6HfqD, The Firm, Satisfaction Guaranteed
41OxaMCY6gMKILoNVd2hdP, Foxy Brown, (Holy Matrimony) Letter To The Firm
4aXYjdLxgXUgFgQk23t8Tv, Emily Blunt, A Cover Is Not the Book
5YWSlrbFrK7X0ENL0uK9Uz, Lin-Manuel Miranda, Trip a Little Light Fantastic - From "Mary Poppins Returns"/Edit
5ollDCofTmRZN0Bbhz4EDW, Emily Blunt, Can You Imagine That?
6BK8BcFxMFr3JVUaAOZsYC, Emily Blunt, The Place Where Lost Things Go
73dmanUYxHGs78LZrXIjph, Emily Blunt, The Royal Doulton Music Hall
5mHWCr85rSyYgg3ldtn0Qk, Lin-Manuel Miranda, (Underneath the) Lovely London Sky
1gqdBjlvy9R78kBSlPtW77, Lin-Manuel Miranda, Trip a Little Light Fantastic
0Nbpc4jzJoRLY6NInYpZWs, Meryl Streep, Turning Turtle
0Zz9oDGJMtk5fDVqOsfMBS, Lin-Manuel Miranda, Introducing Mary Poppins
7mmJdEHM50d1ktLi91d4tJ, Angela Lansbury, Nowhere to Go But Up
4Gxptw0lafCuWfXLNO5ovZ, A Couple, Documentation
1FbKdp4QaSqMnKQCE3Npka, Mah Moud, Sigada
53hmTP8ucFeqWMKtlJb59L, Mah Moud, Queens
3cyhUrBf26T2rpoxaa29by, Mah Moud, Nebraska (Live)
1yXLywsiAuiAvDmI4yTy6e, Mah Moud, Queens (Intermoud)
4G7I1YITGGANZRlBsdDm2W, Blue Meanies, Acceleration 5000 - live
2EpLs2n9GJ68zh24HaKPu4, Notably Proficient Music, Documentation
0KbBCqziJ4DVZNnP90EVoZ, DJ Bo Eli Dip Soul, Documentation
0chmtKI8n1HV8Jyh7oNgR1, Bright Kind, Documentation
3ob1NSGLtIg5nxDgrZK0fC, Alice Signal Fires, Documentation
3lGBvPUgO7MJltUnBlOpe9, Gang Starr, Mass Appeal
0Vc3nfRMdvY5iX6AHVWSMN, ILLENIUM, It's All on U - T-Mass & LZRD Remix
1iXkMRIHkutEsOdN2SkvdP, Rain Man, Habit - T-Mass Remix
6efIeK8Md9RS43qoCTfM35, Jack Wall, Vigil
7EFCvwwCeXn5WGcMvqlQvo, Phoria, Mass (Re-Imagined)
3oDXLJTEs6YX1gJD3aOsnZ, Rezz, Relax
7KlSdIDCajVZgAHpMTMV8Y, Arthur Mass, O Come All Ye Faithful
6e165g8fp2WDCBwF1zxLMh, Slaughter, Fly To The Angels
17Qj1HcrBR00pmTvrs7vDW, Pixies, U-Mass
7j7fS14vlwVk0Pfnr0hovC, Anirudh Ravichander, Marana Mass - From "Petta"
6wycnu8FWXsj68ig7BEot9, Keith Urban, Blue Ain't Your Color
57iDDD9N9tTWe75x6qhStw, The Verve, Bitter Sweet Symphony
1QJvq84l7YcVCyIkGA602c, Keith Urban, Never Comin Down
567gPvGfxxKoZxDKqM9tEl, Keith Urban, Parallel Line
3CcvahnsiArpTHYQEWV2Au, T.I., Bring Em Out
5OUSPcqhYTOzpbXzoEvKim, Keith Urban, The Fighter
17YuXw2ScwLLL1sUrRKhoW, Alina Baraz, Fantasy
1t34UsQ634a233qysq6D6L, Keith Urban, Female
5zouq58uwciUTe0rhrwKmc, Alina Baraz, Make You Feel
4pWb8UZ6IPVJA3CPjCNgzq, Keith Urban, Coming Home
6L89mwZXSOwYl76YXfX13s, Green Day, Basket Case
7AXUdQmZMA5u221iv6gB0m, Sara Bareilles, Basket Case
3cfhXgklWpx5fCSYZOp9Wb, Bastille, Basket Case - From ‘The Tick’ TV Series
6lY715uno7tJwqMK6EL6UU, Cosmo Sheldrake, Birth a Basket
2WtF8X3W7iHPF2KaJGUCuO, Green Day, Basket Case
47qjqoKdbv4dBcbxa3RCgR, Rittz, Basket Case
0nES49gKYMWNLV6los4GQq, AmaLee, For Fruits Basket (Fruits Basket)
766AOUIOIlbYjp5c3La3vM, Gabriel Iglesias, Racist Gift Basket Part 1
4prMyntRyYCFH4DFqVVFk7, Gabriel Iglesias, Racist Gift Basket Part 2
5YzzdnErIvGCJvvAbu5JzV, Danger Doom, Basket Case
5cF0dROlMOK5uNZtivgu50, Charlie Puth, Attention
6pDVjCUA3B1vg9waKutAsv, The Weeknd, Attention
5aqu5xhPqoOWqF71PkfgM8, Joji, ATTENTION
1OKQIvaO7yn7R2BpdUFG7D, Shinedown, GET UP
2hEYslbdYWFSIA6JboUvnR, Shinedown, DEVIL
16wWFYS9S4hKBk2Ofj3Ss6, Rich Brian, Attention (feat. Offset)
1qAuIPMALdFtGv2Ymjy5l0, Shinedown, MONSTERS
7z3EXUkDIgi6y3L46JSklf, Rebelution, Attention Span
5P40YyCrdZRsoj2vTbSyVI, Pentatonix, Attention
24scNJHZfz2ppumDteY2ip, Fat Joe, Attention
5swqdDzbhWfuF9me3n49E8, Boogie, Whose Fault (feat. Christian Scott aTunde Adjuah)
6UFvGJalSngqprmUJd59Eo, Radiohead, You And Whose Army?
2ugGNNwNaJdiusX3aLOMUy, Shania Twain, Whose Bed Have Your Boots Been Under?
6UsaHgjcBmGDte9DgUHcSf, London Philharmonic Orchestra, In Whose Name Do You Ride
0vtvjbeDqVSDl9rdpaQK6N, Shania Twain, Whose Bed Have Your Boots Been Under?
3RUMYJ7hRzZA5Qzf4QlfCz, Cheech Manohar, Whose House Is This?
5OMLc7NdwZpgKVkMx84pW9, Pinkfong, Whose Tails?
0wZTBH3yoq2gb5VRqROE0D, Tom Holkenborg, Whose Body Is This?
0MLqAD0FVivFq37NpnOQTo, A L E X, I Wasnt Allowed to Watch Whose Line as a Kid but I Think Its Pretty Good Now
2mesYIeVcs5Q8NFMKE1JcC, Okey Dokey, Whose Heart
0FpB5z8lQv63hCVuIVqYX1, bbno$, guarantee
2zRSPbAwfjIv9BaAIZHloE, Verse Simmonds, Guarantee
4YVRnPf2I5FXyY8hsHP019, Protoje, No Guarantee
4R0pQBVlk785FAYCfPJJ0E, Aeris Roves, No Guarantee - Acoustic Version
0ZgTez1pojM5aCxsV0hrC9, Chico DeBarge, No Guarantee - Remix Version
7MGvuLN6tgD06ZLR8RT0GN, Charlie Wilson, My Guarantee
1WFqPFWlWaTpYIfppp0EMh, Chico DeBarge, No Guarantee
5b2s9Yp8Y2dJVg4P5ijohe, Rich Homie Quan, Guarantee
2HfUvogVThxjhlNmjZVPzc, Majesti, Guarantee
430tqdslmxnU0fp82DBssx, Jimmy Buffett, Money Back Guarantee
0DjzaYHe4EIoktEaFtPomJ, Dirt Buyer, Josephine
3nxZ7ALduxi7YJsQAyGMxJ, Hans Zimmer, Buyer Beware
5ml0izFxaUiX5Xz53lWGMz, Dirt Buyer, Dirt Buyer Theme Song
2xXqRAS6XYPVaASLKvyBGT, That Handsome Devil, Buyer's Remorse
3dcy20xIP0quo2QfI068A6, Dirt Buyer, Changes
2x2JNBsScb2K8l4eCwDBdz, Christophe Beck, Buyer's Remorse
2lJJdsEVMKdzV5aGqrsCbk, Dirt Buyer, Spin
76d84PXWY00FRRFIiy8lSE, Dirt Buyer, Gift
2mf13Q0cusU2yAcRd2SJNS, Terrace Martin, Happy Home (Freeloader Renter Buyer)
4bUrbDFcuuYxLPJoz9tZPU, Dirt Buyer, Papa
6oPsQApKb0IC5KYzO6uiyv, Anthony Jeselnik, Standards and Practices
5b9OI9BEWLMmp7jqv37bbB, Serenity Music Academy, Healing Practices for Mind & Body (Equilibrium)
61ZCqeCGv7Im6HlGzIvpRY, Meditation Music Experience, Meditation and Relaxation (Meditation Practices)
3KTZxWjrAinjxcBlC5gazk, Municipal Waste, Standards And Practices
6BClgGQPiFJq8A9eE44o6b, Face To Face, What Difference Does It Make?
2cCXwgRu7xPqkWCIVmcFzE, Face To Face, Don't Change
5M3w8I85bW5sxX1UCQu3Dv, Chakra Music Zone, Healing Practices for Mind and Body (Yoga Rx)
0QAGKEHdSrHTEUtXMsODzS, Ingrid Laubrock, Contemporary Chaos Practices Pts. 1 & 2
1dUGLdp3tSineUkPClpzBF, Emperor X, The Magnetic Media Storage Practices Of Rural Pakistan
4dEpwpGvhhMVRUwsi5ZdQ4, Yoga Tunes, Yoga & Balance For A Emotional Flow
1kHpljP6paUsQyZgwFDfxn, Fuerza Regida, Radicamos En South Central
3MchT9tQcPTzZWmd1MXgLS, Los De La Noria, A Las Cuántas Decepciones
4PR0r2us3a64lTew6TVlF2, Fuerza Regida, Sigo Chambeando
5fEjHVoytz1riRj0zwzVLg, Pancho Barraza, Mi Enemigo El Amor
0SMkzFGJOBFDI9KfYD55L0, The La's, There She Goes
6tjibNFk7OWKaXaE7rTyzF, El Fantasma, Las Verdades (En Vivo)
5OUGSwa2eadrcAsMdUItmO, Banda Sinaloense MS de Sergio Lizárraga, Mejor Me Alejo
7ke7RmdPVzXXzwodE7ybWL, Ulices Chaidez, Las Enseñanzas
4c0QxJ6DWVRHi8sAaFYczt, Los Minis de Caborca, 18 Libras
4CAoxv3Sppq7udbStUqk9D, Banda Sinaloense MS de Sergio Lizárraga, Las Cosas No Se Hacen Así
4NrxgGOzOcmo1EEaPZE3UQ, Jaydayoungan, Muddy Situation
1D7UBHqaPWDbBHs2S5YXge, Weezer, Perfect Situation
1QlogZxaAT35c3HqjJt1JH, Yaz, Situation
6OHWgUuDDedHRVhcg8vlaf, Flying Lotus, Massage Situation
1AIU8KPpCSTnGtDvl3N02o, Dave Matthews Band, Typical Situation
0D8nfD86kk0SW5DuJRwXh5, Ryan Bingham, Situation Station
0FqMZmwe9qJ3nR5FuYpyoY, Mötley Crüe, Same Ol' Situation (S.O.S)
1rMdaGjFzmUMwSJlpRXIMQ, Kevin Hart, Situation On The Phone
6d4B82vt7pjdzumBmV6HiZ, Bob Marley & The Wailers, Real Situation
4l4J2pGwlOq0sYIdyCWTxO, TYLERxCORDY, Cheap Situation
0pbL5oqHAWmbeVoB75p5v2, Wheeler Walker Jr., Anal & The Dishes
4FMudjY0MDRcsSOj0nhTqG, Wheeler Walker Jr., Anal & The Dishes - Spotify Commentary
3Ba8hLqfoeldTGn4tJbryW, Joe Rogan, Q&A - Anal Lubricant
6Twg3ltDIP0p232hRdR6T0, Los Amigos Invisibles, El Disco Anal
6VfvLmHZdvFEgFmSUF9bCL, Lil Spryte, Barnacle Porn
7McmqgQJDLYCPIK55BEnKn, Infant Annihilator, II. Anal Prolapse Suffocation
6Eh8S7hlxSP4nGr13ycO4z, Secret Anal Terrorist, Anal Ninja
26lyd8FGACY5xs4sx9g1uY, Secret Anal Terrorist, Quadratic Anal
66m0HT4cVHgHLKCMlgKTNy, Los Amigos Invisibles, Disco Anal - Versión Acústica
262Tg64JF7mYVVoFx7uQ66, Ali Wong, Anal
6bKUUSlzDua0gt0g13OKqw, Trippie Redd, Diamond Minds
1k7KigfkZh2Xb6khqV1a0K, YoungBoy Never Broke Again, Diamond Teeth Samurai
4J4zx8xGJpuGndrVc06KaT, Alan Walker, Diamond Heart
62AuGbAkt8Ox2IrFFb8GKV, Neil Diamond, Sweet Caroline
7lUE02KHkZM44BZgjCaWRO, Diamond Rio, Meet In the Middle
3KH5aME71gFcHvReW54ew4, Mark Diamond, You're My Girl (Lost Recording #6)
3298yRJKPcCndQdNiTZKIo, Neil Diamond, Sweet Caroline
24Nt4OalWDICkEKVy81X6k, Cody Johnson, Diamond In My Pocket
0nrWZWkJM62ftQJSI8fDc0, Alan Walker, Diamond Heart
2EC9IJj7g0mN1Q5VrZkiYY, David Bowie, Rebel Rebel - 2016 Remastered Version
1gugDOSMREb34Xo0c1PlxM, 5 Seconds of Summer, She Looks So Perfect
6gQUbFwwdYXlKdmqRoWKJe, Aerosmith, Dude (Looks Like A Lady)
4Z9npQ93MrnIkRcTBKwSa3, Steve Lacy, Looks
1pm6AoOYO81llP3gwkTAbI, Jason Aldean, Tonight Looks Good on You
5uRN4EmPA7BWs5f4xsIl0Z, Mötley Crüe, Looks That Kill
2JATE4qxTuVgKEKe12sqLp, OneRepublic, Future Looks Good
3P3Rj89T4jl2QczwR3TMRr, Jack Johnson, A Pirate Looks At Forty
19nUjmaqEhWvOtKk72NXGC, Courtney Barnett, City Looks Pretty
7itYSYvjxlKqnjVJzfVi2O, Mayday Parade, Looks Red Tastes Blue
4z6mZWFgBZd07926K61Mi8, Arctic Monkeys, She Looks Like Fun
6JikuKcWFuPPC4MyKfvkHQ, Marianas Trench, Desperate Measures
0nMwcep8TzjPqokMJ19t2z, Bayonne, Drastic Measures - Single Edit
4TLK7Umh2d9UO3ZajvE6AV, Underoath, Desperate Times Desperate Measures
6Djw3pnqX3lRAA1iiGHK1F, Hollywood Undead, Tear It Up
6ugWTKhdkppdMQsRRnwQlu, Hollywood Undead, Dove And Grenade
4GhiV5H65Nce1k14zkKNnb, Hollywood Undead, El Urgencia
74yVjH8BuqcMKw04KQVd5C, Hollywood Undead, Shout At The Devil
4f8cAsTluzXnV9xDAy4qCB, Mike Bars, Up to No Good
5OskFqru5Q5oD090g5kYDt, Bayonne, Drastic Measures
5FT23ezfwdnsjXOquDcUcn, The Prize Fighter Inferno, Half Measures
6J1R5wtPXiHiwiPstOSI56, Alex Sensation, Que Va
2MN641SexYaEM1neDbHrWe, La Arrolladora Banda El Limón De Rene Camacho, Me Va A Pesar
5u6y4u5EgDv0peILf60H5t, Santana, Oye Como Va
5jEk9xozawNIRrChjPUvrC, Remmy Valenzuela, Se Va Muriendo Mi Alma
2jATUzETZL49e6SywauZKE, Nicki Minaj, Va Va Voom
1OYoXMNCUYlpDyMONw2sNc, Intocable, Alguien Te Va A Hacer Llorar
4VinpEidS9wmMuqmljyd21, Banda Sinaloense MS de Sergio Lizárraga, Se Va Muriendo Mi Alma - En Vivo
2h6WIOkTPvHSAD7vR6lMSS, Maelo Ruiz, Te Va a Doler
4FDV9Ed1NwD8n9zVYF6THT, Ha*Ash, Eso No Va a Suceder
4hHrTfh4yyDpfiz9ulEHZv, La Arrolladora Banda El Limón De Rene Camacho, Me Va A Pesar
6xVq4SrxJHWLLKq91ZeCqm, Buzzcocks, Ever Fallen in Love (With Someone You Shouldn't've)?
4vU5TfGGHeIwKVzWSov8TM, Manual, Awash
775ta9nosnNeIR0ppeMbLh, Ja Rule, The Manual
0yiigrFvNj02eIlqM8ZGXf, Eddy Kim, The Manual
54r8KibtmiMzKnj5qAKpg9, Eddy Kim, The Manual
3NHFycTyi992KM6dkhSZcR, Buzzcocks, What Do I Get?
55N6XPkC4jQ9TAQsAAhvej, Buzzcocks, Everybody's Happy Nowadays
0LPw1dW0P8A56E5kYgNPFt, Eugenia Chasey, Manual Ocean
1GlFf1f1fkvAs0Ni3UCk64, Eddy Kim, 2 years apart
4i32VS1xMaAogPusPcbbJO, Bridie Madinger, Manual Dream
7Ar4G7Ci11gpt6sfH9Cgz5, The Doobie Brothers, Listen To The Music
6kCqR0FkkD668JMTXBAGw7, Dirty Heads, Listen To Me
5b2bu6yyATC1zMXDGScJ2d, David Guetta, Hey Mama (feat. Nicki Minaj Bebe Rexha & Afrojack)
78TnMTAFmWUWWCgNXR7D3K, Roxette, Listen to Your Heart
2fja4gHzPsIXiK4bMeU0hN, The Doobie Brothers, Listen To The Music
5950bEMaJuqOp0TB248yBa, Marvin Sapp, Listen
3huV7eiNpaQlCB3LbZi9bB, The Kooks, Bad Habit
4z7Ja0RNran3XpIvc1PIQz, Beyoncé, Listen (From the Motion Picture "Dreamgirls")
4mvPRLDf0ZedTzzXaXEavJ, Declan McKenna, Listen to Your Friends
4feNlb6HlpBrW36SsXoUfh, The Doobie Brothers, Listen To The Music - 2006 Remastered Version
0gGJO7JM51uAUu7EE2lxx6, Rainbow, I Surrender
4yUgnPefkAMkgLVo3kVvF5, Soothing White Noise for Infant Sleeping and Massage Crying & Colic Relief, Rainforest River to Naturally Calm Comfort Relax and Soothe a Difficult Baby or Child
2tq5ydfpQjgdb0lmm5IqeJ, Billy Raffoul, Difficult
5lxus7Uge3HPujvzCa5SCh, Peppermint Ollie, Difficult
6V3XtV3jPvowwPWMx12Ln8, Speed Gang, Difficult Roads
5jxNdmYpGOhkvD75YcOitI, Elderbrook, Difficult to Love
6XCv0uKM3j9tHv4BcUrqZB, Sheryl Crow, The Difficult Kind
0P7Jv9NzNUS1qgvZTaRb8f, ONF, Difficult
0aQ7gMSCHvrbtPgY1QdLsC, Mark Williams, Exploring the Difficult Meditation
3U9Vj3RzlJioIP2KfUIII1, Uffie, Difficult
3QZ7uX97s82HFYSmQUAN1D, Rush, Tom Sawyer
