6m9qPYXmhge2QhBLfFKnVF, Chance the Rapper, Same Drugs
0v9Wz8o0BT8DU38R4ddjeH, Chance the Rapper, No Problem (feat. Lil Wayne & 2 Chainz)
3eze1OsZ1rqeXkKStNfTmi, Chance the Rapper, Juke Jam (feat. Justin Bieber & Towkio)
7LnU4vflcZ8fyuFaVxGtuN, Tedosio, The Book of Jen
60xaS8mYBKUW4VQQ666N0T, Chance the Rapper, All Night (feat. Knox Fortune)
1Uq3IOIy1CUlHUgP6vWpum, Chance the Rapper, Smoke Break (feat. Future)
1D23GEeQ32aqLw5ZnY3Ivp, Ski Mask The Slump God, COOLEST MONKEY IN THE JUNGLE
3ZLyt2ndLFBh148XRYjYYZ, Chance the Rapper, All We Got (feat. Kanye West & Chicago Children's Choir)
4aXYjdLxgXUgFgQk23t8Tv, Emily Blunt, A Cover Is Not the Book
0jx8zY5JQsS4YEQcfkoc5C, Chance the Rapper, Angels (feat. Saba)
6A8dnC0xkiuWN4BshmTB2I, A R I Z O N A, Oceans Away
0AS090YJNo3vh75GrFxwbX, A R I Z O N A, Electric Touch
4FjPJhlEIWB9QVKFTc78Nn, A R I Z O N A, Cross My Mind
76viqO3tGyWHYbJgmV2gfN, A R I Z O N A, Ain't Gonna Leave
5j4mKTvOu0cr4cooq57sm3, A R I Z O N A, Where I Wanna Be
2driOHZZnMIlaUIt9e3SRD, A R I Z O N A, Feed The Beast
6se160dvONwrpI4G51bnVE, A R I Z O N A, Annie
7yVJlhAZlZ4O1jlJCkMXD6, Mario Vazquez, Gallery
2PaNQL6MhyTLquEuvdNKbo, A R I Z O N A, Brave Enough
3a2MbZSw3NGRWHqsCJ4iQj, A R I Z O N A, I Was Wrong
4sY3JiBfTCqInH7Tov3dxx, Flatbush Zombies, Trade-Off
62lc21zAcKWs11pbSOabO9, Panic! At The Disco, Trade Mistakes
6180Fv9Y1zovHtrIVaTGSM, Q-Tip, Won't Trade
5ZE02ouaApixtVMLd96E67, Jason Derulo, Trade Hearts (feat. Julia Michaels)
6h7PQQIUQSNSAWqRe98MBU, Fabolous, Trade It All PT2 (feat. P. Diddy & Jagged Edge)
2Wq7Qx5RARpdZ7Kxp5LUSc, Leftöver Crack, Gang Control
2gr9rXVQf8PwBW2S9ug2dR, Todrick Hall, T.H.U.G. (Trade)
4DTbk7mzNYJkZDE49xAsw0, Max & Harvey, Trade Hearts
1x4co3nrqL4kuiqYXh0nJk, Fabolous, Trade It All (feat. Jagged Edge)
4RCP3wFIDtAtGd59wFxuNn, Knox Hamilton, Trade My Trips
37HWizYgRKyBa323UMHO2q, Whether I, Gemini (feat. Jonny Craig)
0PJuJ0epK6kXibYwQjf6nx, Julia Holter, Whether
2rYKc37Ahg3JP7fAMFb8G0, Whether I, Dreamcatcher
4ebkPNHMYbZWv5pRrdP8ZP, '68, Whether Terrified or Unafraid
6p9mdqwpHpLCLw65HG6fsq, Whether I, Is It Too Late
1gYEcLU03syUGRl9THSXxd, Whether I, Here's to Tonight
7zETyhThy0BMlOrJFK7Xb7, Gabe Bondoc, Whether or Not
2rhmpMoZ4dZdnVk8wh69ha, Whether I, Among Lions
6OABD7E5YReJuGHdWRv2zZ, Whether I, Half Life
4J06tKj1gURqhyJ5YouL5M, Tracy Bonham, Whether You Fall
2MLHyLy5z5l5YRp7momlgw, Weezer, Island In The Sun
1iuljeYz6ZG3GTJOZZkoer, Fetty Wap, RGF Island
3HKiR4t12GW18bnPUVhx5l, Seven Lions, Island (feat. Nevve)
6Rk9OCPLRprxsMmYgnU1UF, Dermot Kennedy, For Island Fires and Family
0f2quK7KHrF2hUkJQhj2eV, Calm Shores, Solitude Island
5ukbCSlWXCWimfHlajkhhn, Dan + Shay, Island Time
3UltPYuSY57T9BBAtN8w9L, Various Artists, Island Song
2xkgm3ZHezoiW9tGblP5gi, Ólafur Arnalds, Dalur - Island Songs V
3dW7J5pJFu0nE4eGtmcqey, Alaskan Tapes, All Was Quiet
0LDFH1WLQ6NPEMH556LUGs, Jessie Reyez, Shutter Island
3QLjDkgLh9AOEHlhQtDuhs, Drake, Best I Ever Had
3fyMH1t6UPeR5croea9PrR, Drake, Best I Ever Had
2JSnL1yIvXW2PMXuPLD4Vd, Florida Georgia Line, Like You Never Had It
3lBRNqXjPp2j3JMTCXDTNO, Beyoncé, Best Thing I Never Had
1RRZSm4akqNyMOsPUhw4cb, Shawn Mendes, Because I Had You
5GT8b1dFaOWFF5twsmSOYx, Nina Nesbitt, The Best You Had
2Go8QT5Cw4sCBzq8ZjnZLl, Cassadee Pope, If My Heart Had A Heart
6Y0kwGULORFXHzwOBUlMqf, Kevin Gates, Had To
6XFHAb88yMCSWSt5pVSxnE, Souly Had, Crush
4BFMQ15vXr626UOoZL8bUI, Bill Medley, (I've Had) The Time of My Life
6vWEAOUSxohKxhp0K1BsxL, YNW Melly, Mixed Personalities (feat. Kanye West)
1oJ8EDr2pv94IvSd6ZmDgo, 6ix9ine, MAMA (feat. Nicki Minaj Kanye West)
4S8d14HvHb70ImctNgVzQQ, Kanye West, I Love It (& Lil Pump)
0EwS8XJQspgrj1zSUXhFkl, 6ix9ine, KANGA (feat. Kanye West)
3U21A07gAloCc4P7J8rxcn, Kanye West, All Mine
1PS1QMdUqOal0ai3Gt7sDQ, Kanye West, Gold Digger
4EWCNWgDS8707fNSZ1oaA5, Kanye West, Heartless
6C7RJEIUDqKkJRZVWdkfkH, Kanye West, Stronger
2gZUPNdnz5Y45eiGxpHGSc, Kanye West, POWER
0T6RSXxFhW8dRTWHI604ld, XXXTENTACION, One Minute (feat. Kanye West & Travis Barker)
7x8ILiGyZAFW3F0rPUPYxm, Regina Mira, October
3JD5xfa8pgJi0AzdRCRETW, Mumford & Sons, October Skies
1BYZxKSf0aTxp8ZFoeyM3d, girl in red, we fell in love in october
6FIQ8o2hqlDmHQFoBKmKgW, Icarus, October
3yuFexYOxPrKYtwikc2YwV, Ebb & Flod, October Skies
2SiqlgLMfKQbczSMRp8drY, Blue October, Into The Ocean
09zDgbs5NQH1kKFXHppYhr, Broken Bells, October
2YJNoQKf1MPwlInwFPw28P, Blue October, I Hope You're Happy
1tL40tfdtUaSLek4DvDDr3, Blue October, Hate Me
0nILp5SpecXFvJQotZe48y, James Taylor, October Road
2L40jemCD4wPi0CWx7iAxg, Wolfgang Amadeus Mozart, Don Giovanni K. 527 (Excerpts Sung in German): Schöne Donna! Dies genaue Register
3ibni3TQ1M9S8tciqbXU4I, Sweetheart, Register Girl
7bATxCDIptPFOXXXQr3YwZ, Baby Keem, Register
0CMely32cExbJzJwfrK22x, Black Register, Death
28txeoMH34IK4a6rFyciqP, Black Register, Heavy Metal Maniac
7KzlSZRfk8QtqD82WFrA1V, Black Register, Always
7uLPhYqz7gj61OudMg39bC, Black Register, About K.V.T.
7trsU12Tn9K1bTnLppauBM, Black Register, Toga Toga Toga
538dK9O7pcI9CaclEJAPyp, Black Register, Doubt
36uXefgS1GGpTsALvmUhZo, Black Register, Player
7dyluIqv7QYVTXXZiMWPHW, JAY Z, Numb / Encore
5sNESr6pQfIhL3krM8CtZn, JAY Z, Numb / Encore
1diH47vlrWIEwlpS0pXXkE, Lowercase Noises, A Course of Strengthening Medicines
0gqfvyewE2Sh8TwKBFajCF, Lil Uzi Vert, Of Course We Ghetto Flowers (feat. Playboi Carti & Offset)
7dvd3b2oz7AFgXrPBIIYxR, JAY Z, Dirt Off Your Shoulder / Lying From You
65eohvrL4ttjA7EfFkQOhX, JAY Z, Points Of Authority / 99 Problems / One Step Closer
4DLH2fr8pWX1iksMrk47Kw, JAY Z, Big Pimpin' / Papercut
6N49RDNEyXD2dXnxD9pCLa, Ryan Oakes, Of Course
39sUeHQoIGY6BEIcgTMRXW, JAY Z, Izzo / In The End
4pnFRnCOfaETea25g0YSvG, JAY Z, Jigga What / Faint
5dpAN1mjFPL38kh9kWsCiw, Default, Wasting My Time
4vEXJ6NvEwS8ptynkNswaa, Queen, You're My Best Friend - Remastered 2011
2GAIycsMaDVtMtdvxzR2xI, Queen, Bohemian Rhapsody - Remastered 2011
6u91CCTziobh3twCDMBlEk, Public Image Ltd., Rise
1jmX5Dojaopg8DT05Mw5Ig, Queen, We Will Rock You - Remastered
6oKI26bh1VZcBe3SQNM2ZT, Default, Deny
5qqsLifWB9BhGQtFmR1e4R, Mimi Knowles, Limited Edition
5tRrN6eD8YE6kfWSwSgDGv, Pimp C, Knockin' Doorz Down
3HkMNtOIciULbIrsxyl1mq, Pimp C, Pourin' Up
2U9v51tNOoLRhwrU6j83uU, Queen, We Are The Champions - Remastered 2011
3MZjOGeXhpHbQ9ESMNFFnH, Steam Powered Giraffe, Honeybee
3R5RZugUFwx47eQDvtEKVw, Deastro, Light Powered
1vRnOlS6Hei11RiUkKCXkO, Steam Powered Giraffe, Automatonic Electronic Harmonics
3Isy8p53mZTC5xBYZIHOu1, Steam Powered Giraffe, I'll Rust With You
4Jo29Uu8726KtzclLNBbmc, Steam Powered Giraffe, Brass Goggles
09UqPuD3hBsfqFcvDfUumo, Steam Powered Giraffe, Fire Fire
5jnAm4svNhOWL4o1Om8Por, Tobee, Cordula Grün (Ich hab' Dich tanzen gesehen)
1i5X5cuHxBzBRs9QHZi4QJ, Peter Wackel, Ich verkaufe meinen Körper
6nJqYDlcmbH2NOLYinu31y, Peter Wackel, Die Nacht von Freitag auf Montag
4xV98Vyjksk7uT4aBxgigN, Scarface, High Powered (feat. Papa Rue)
18AXbzPzBS8Y3AkgSxzJPb, Phil Collins, In The Air Tonight - 2015 Remastered
2bLqfJjuC5syrsgDsZfGmn, Timbaland, The Way I Are
6ucR4KfvsBFWCMVFDvyKKl, Timbaland, Apologize
2DHc2e5bBn4UzY0ENVFrUl, Timbaland, Carry Out (Featuring Justin Timberlake)
0wbDgMuAoy7O7pL3a69uZx, Timbaland, Give It To Me
4ymByZAPRqTlyJASAoJ921, Timbaland, Bounce
7qje9qxLncMESiPeI27SAn, Timbaland, Say Something (Featuring Drake)
360UM2DaiHZPRu0EsrOvMp, Timbaland, If We Ever Meet Again (Featuring Katy Perry) - feat. ケイティ・ペリー
7l8YQsU2jH0BJxmhbBgMc6, The Story So Far, Face Value
7y2Ix8HOPi4E7hteSaKD26, HONNE, All in the Value
4kHMEpUfa8YM88C7wsAjUU, MF Eistee, select
1TulMHJg9PrNqU6zwfqCBT, Starbomb, Smash!
1TcZiUXjKy64dMFz4H3b3S, Periphery, Marigold
6VqDlTqw5zsuJ4GJ34s5fT, Starbomb, The Hero of Rhyme
5Cd7HqwrBcpINtQrrPta65, Starbomb, The Simple Plot of Metal Gear Solid
7FZqvQbxxUwTaVGdUxV6bT, Thunderstorm Sound Bank, Select Night Rain Storm Sounds
4qgPLAskMb4kaRuX03FPwj, Starbomb, Minecraft Is for Everyone
4NJYfv0qArx0aDzIVBDgnO, Periphery, Lune
5y3HTFcloYV3IA47q93quJ, Periphery, The Way The News Goes...
6NIs0JQvFgNjnVHOSQepn7, Starbomb, Glass Joe's Title Fight
3S4px9f4lceWdKf0gWciFu, Sia, Cheap Thrills
2d4e45fmUnguxh6yqC7gNT, AC/DC, Dirty Deeds Done Dirt Cheap
2ccUQnjjNWT0rsNnsBpsCA, Cheap Trick, Surrender
5DUPCIO2cmdB6GEOJXsw2Z, Ella Mai, Cheap Shot
6b3b7lILUJqXcp6w9wNQSm, Sia, Cheap Thrills
1JkZg3eMQTmTn93E8Yd3UL, Cheap Trick, I Want You to Want Me
7jJsme36M90Cn6aYYC2l3t, Nick Murphy / Chet Faker, Talk Is Cheap
1xKQbqQtQWrtQS47fUJBtl, Big Brother & The Holding Company, Piece of My Heart
1KTkfG53uAWmD5AknK8qWY, Cardi B, Cheap Ass Weave
5KM3PHkYS0H4RKVI0zBShC, The Bellas, Cheap Thrills
7kGLLve90hHNcaLIlIR3TX, Domenico Gabrielli, Canon a due violoncelli in D Major
5LyRtsQLhcXmy50VXhQXXS, Megadeth, Holy Wars...The Punishment Due - Remastered 2004
2Vevs2eAQNNb7NTpKj5kqA, K CAMP, Cut Her Off
3pT00QwvR8AzFtL3hedljs, K CAMP, Money Baby
1HlOGL1p6wlpOZatJ2NwFk, Killswitch Engage, In Due Time
42EtdFbaqfBokco4oSBWsH, Kelsey Lu, Due West
2h82pgSwoWbhiedinenqLC, Run The Jewels, All Due Respect
49ONd7q61KYjSZE0A8gtCW, K CAMP, Blessing
1Zv6RyHM08gyC4qvOlCZUL, Lavinia Meijer, Due tramonti
0pC3LbmoRyCz4aZGpt4FSy, Blake Shelton, Hangover Due
7e8utCy2JlSB8dRHKi49xM, Arctic Monkeys, Fluorescent Adolescent
6RJdYpFQwLyNfDc5FbjkgV, Disturbed, Stricken
1H4idkmruFoJBg1DvUv2tY, Paul McCartney, Band On The Run - Remastered 2010
58ge6dfP91o9oXMzq3XkIS, Arctic Monkeys, 505
6u1yKoh00WaoSpNp46RzKF, Seven Mary Three, Cumbersome
4T6HLdP6OcAtqC6tGnQelG, Michael Bublé, Everything
2id8E4WvczfKHB4LHI7Np3, Stevie Nicks, Edge of Seventeen
79gkHjNTSyGPXEyGkNQ8zH, Enrique Iglesias, Cuando Me Enamoro
4nVyHATevhl5RC6Qmoko5H, Enrique Iglesias, I Like It
5hkgrWxkobGtg30I7DsfVu, Disturbed, Ten Thousand Fists
7wC5eZcFS1Q1BsQ35DU6H4, Billie Eilish, come out and play
4jvjzW7Hm0yK4LvvE0Paz9, Lil Peep, Falling Down - Bonus Track
2Grb4G6t9VIqo6moKUloom, Metro Boomin, Don't Come Out The House (with 21 Savage)
3UhRsQVrELOATEiY7E9X2T, A Boogie Wit da Hoodie, Come Closer (feat. Queen Naija)
01z2fBGB8Hl3Jd3zXe4IXR, Mac Miller, Come Back to Earth
1Ser4X0TKttOvo8bgdytTP, Rae Sremmurd, Come Get Her
0EMmVUYs9ZZRHtlADB88uz, Dexys Midnight Runners, Come On Eileen
5xNUR50KxswPRAvx7S163g, Hugh Jackman, Come Alive
4P5KoWXOxwuobLmHXLMobV, Nirvana, Come As You Are
1m8WpLYXEiNVZchsWEcCSy, Miguel, Come Through and Chill
7vu0JkJh0ldukEYbTVcqd0, Julia Michaels, Issues
1ysDVWxBj5Set0fA05TcyP, PnB Rock, Issues (feat. Russ)
5E30LdtzQTGqRvNd7l6kG5, The Neighbourhood, Daddy Issues
0AxuvWeoEODrAkPJQ5X0ls, Olivia O'Brien, Trust Issues
2F6FfZ4w8z3eJpSxPotVO5, Korn, Falling Away from Me
0bxmVPKnEopTyuMMkaTvUb, Teyana Taylor, Issues/Hold On
0Eo4zOJR1KBAUpDsBwad09, Demi Lovato, Daddy Issues
4eK2QvWTReLe8xPST7EjdJ, Pouya, Daddy Issues
2ZM5hdzd0HiZ7UYkw9YcBg, Sik World, Mental Issues
3abKAw6reL2U3vhAe98ZsY, Julia Michaels, Issues - Alan Walker Remix
6LW3Z1GqbL78TIjfDyg4zp, Wilkinson, Afterglow
2rnDPE04mBt78lfmp9JNDP, Wilkinson, Take You Higher
7CJz1eY38spdmy4Oe77FqV, The Dillinger Escape Plan, Apologies Not Included
1owYHNKxY1q9ufNz0icCqE, Wilkinson, Dirty Love
4quvzoKh58pBSMHRlHMDum, DJ Chose, I Thought
1xciMiNZThcdvB5WV476Hq, Wilkinson, Afterglow
24zbxPspva0ZH8hTpQ5Hm0, Wilkinson, Half Light
5f68496SspoGyA7aqcljU4, Wilkinson, Heatwave
090u7je6J6uRt8boxhYx2V, Eric Thomas, Instructions Not Included
7APMxrav38Mzh2cqX9AySV, GT Garza, Like What You See (feat. Z-Ro)
2JvzF1RMd7lE3KmFlsyZD8, J. Cole, MIDDLE CHILD
6Up545NUflOiXo8cEraH49, Lauren Daigle, You Say
4MhTFsyqIJnjsOweVcU8ug, Guns N' Roses, Sweet Child O' Mine
7H6ev70Weq6DdpZyyTmUXk, Destiny's Child, Say My Name
3UUPQ4sAtAVnkcaSr06NBi, Lauren Daigle, Look Up Child
29H8RkqW9GaFy8tdjriuX3, J. Cole, MIDDLE CHILD
7n1940b6kHcaEewFSZXnXa, Louis The Child, Better Not (with Wafia)
4pmc2AxSEq6g7hPVlJCPyP, Destiny's Child, Jumpin' Jumpin'
2V65y3PX4DkRhy1djlxd9p, Swedish House Mafia, Don't You Worry Child - Radio Edit
2Mpj1Ul5OFPyyP4wB62Rvi, Destiny's Child, Survivor
5hc71nKsUgtwQ3z52KEKQk, The 1975, Somebody Else
0pdKRp2sUthTPe7RLWpPqQ, flora cash, You're Somebody Else
10igKaIKsSB6ZnWxPxPvKO, Metallica, Nothing Else Matters
1HOUzEsetdIPSpAgRPhZQt, Trey Songz, Nobody Else But You
34i4yxPrHWquuR4kjiivFO, VÉRITÉ, Somebody Else
6PlrGEPaisOqBiDlwW6Ic0, Ncredible Gang, NoBody Else (feat. Nick Cannon Ty Dolla $ign & Jacquees)
7dX17Wj6NWLALffTQURbNa, Axwell, Nobody Else
41Az1BCotlAUt7Ud8k6H2Y, Jack Johnson, Sunsets For Somebody Else
3n2A6l4UayVe3GGKCvfQWV, Justin Moore, Somebody Else Will
04BwBjVvvHshN9RbqNXfWQ, Monty Datta, With Somebody Else
6G1i0Uv6Nkhb9CnksXCfAx, Virtual Riot, Show Up
3p23SEF1mvTwh4IW1dIX1p, Virtual Riot, Pray For Riddim
5UOzuTyhEtitfDakHpOpiS, Virtual Riot, Chop Chop
2y9egVr5ED9XNCV0Etym4F, Virtual Riot, The Darkest Night
25GcNk1AqlRmtcdWONCc3z, Virtual Riot, Komputermusik
6nShoVDUQXjD8yS8m7jaW4, Ace Ventura, Pranava
2yOzbmPgEQDlcMsZbEMnRb, Thy Art Is Murder, Engineering The Antichrist
4AJSr9NcPHQJeXaYqaWhJj, Paul Haslinger, Reverse Engineering
46WbQ72VVxywjDe66DboWx, Virtual Riot, Jump The Gun
7npDS6ILdr6aJsp4Uw2wLw, Ace Ventura, Neurochemistry
0FgNSsaSZTvbLXUumSO8LQ, Arctic Monkeys, Star Treatment
1mzGywacjpeik00PVLBPpF, John Legend, All of Me (Tiësto's Birthday Treatment Remix) - Radio Edit
110w73fvP7BBkELWhT00MV, Binaural Creations, Insomnia Treatment Deep Thunder
5xr1WJoD62Bz38tdoUl3xV, Eric Bellinger, Silent Treatment
0FNPiAAdWdWaGr7JOnlKmi, Snoop Dogg, Imagine
4UprL40OVADveANAtCNrIa, Snoop Dogg, Boss' Life
2TgPHDU8zPgAvkSLXkHKXR, Snoop Dogg, Vato
1X0ndivnYmiD54hxQ5DALW, underscores, voice of reason
04lSKA5b9vrV0G4qi2TPdC, Massage Therapy Music, Weightless Moment
22apaLQ7vvCed6FADqU49E, The Roots, Silent Treatment
4VcPtoOpK3oBMDZJ9Ptp9f, Only The Family, No Auto Durk (feat. Lil Durk)
4Kw3CztmD15X1QGDnnHmLD, Migos, Auto Pilot
2oMOqX9k4k16odibNkYyrD, A$AP Rocky, r - Cali
2Rwux3fRY1xxl167muIo93, A Flock Of Seagulls, I Ran
6TvVM0uHHFbMtr3uhgDXyu, Roy Blair, Grand Theft Auto
03Z9Xiu6te6MbMRlICuDGL, Tyler The Creator, Garbage
1EjgfvEGRwfjrzzMl3WPqR, Only The Family, No Auto Durk (feat. Lil Durk)
0TGi4ML897zq1qDcAheMIY, Vilma Palma e Vampiros, Auto rojo
1zdsOgv1hdGGGe9CK1QPY7, The Chain Gang Of 1974, Sleepwalking
2Nt0KxMdXtpwUiiiIFp2Cq, Queens of the Stone Age, Auto Pilot
10rO54lvVvIv3zfucLhLRx, Eastside Da G, Important
0ouB74KXHucecyHKeE4cgI, Moneybagg Yo, Important
24Eu7wWvFS7YVF7XHwdUTV, Pretty Lights, More Important Than Michael Jordan
3FsArs7b9A1BJ579Ib6UGo, Quin NFN, Important
5lYMGNXk3KnB53Pah8qDKp, King AL, The All Good Important
1WslGHBNd54P0RhzWAaQFr, Lil Pete, Important
7tpiUU9ymBZ08FS7TuSRxK, Eat Your Food, Get Up1
3tObuNgkiUfy14HFfP2GRr, Dads, Shit Twins
1aQkOyYzRWINJzzTQH9wzm, Winston Vega, Important Intensity
0so5X8AhPsl77Ye90SvN6Z, Eat Your Food, Happy Place (Outro)
0UgBxQ8BOl0rutAQqNGz4Z, David Arnold, Work Out Videos (Laugh Factory 2013)
3lA8PYqQceb8rZBSYUGzjq, Mustard, No Pictures No Videos
3x9LFpV6tzq0qWaBMvY2UT, Ciara, 1 2 Step - Don Candiani Reggaeton Mix
1mlTY8ExvoGRx2ovfJcLYx, Sam Lachow, Cadillacs & Videos (feat. Ariana Deboo & Magik)
0REbTzx54wBXjanN233DI3, Levi Niha, Eleven Eight
7fEl6vOERWBJ1ho29gDwaM, The Videos, Moonglow You Know
5Dmv8nLhCPSWlfhHpgMFm8, Levi Niha, KK Slider
3wu9cZ8nli2GIaXBy8bRkI, Thomas Newman, Weirdest Home Videos
7pKAMtb1qITl5JidyFtx00, Mew, 85 Videos
6M5f8Hv2QTZcG5hUuMkRGC, Mike Rittenhouse, Friday Night Videos (Live)
4T652DlATVHe0jdLKaN3Bw, Ariana Grande, in my head
1tT55K6VEyO6XFDxK4lDQe, Peter Manos, In My Head
4ly1QBXEwYoDmje9rmEgC4, Jon Pardi, Head Over Boots
1N7YeVU0ZwAFbOhwM61ef6, Avril Lavigne, Head Above Water
0Veyvc3n9AcLSoK3r1dA12, A Boogie Wit da Hoodie, Voices In My Head
6TodWdTSDfzwgYynTZSvJn, 88rising, Midsummer Madness
3shHzEWwP2671lV4AscHhZ, YoungBoy Never Broke Again, Head On (feat. Kevin Gates)
75JFxkI2RXiU7L9VXzMkle, Coldplay, The Scientist
5BoIP8Eha5hwmRVURkC2Us, Jason Derulo, In My Head
4TwVtW8hS5LyLoDtJGpUOg, 88rising, History
3Knohqfb9jeYzL6wMZiWLM, Howard Shore, The Council of Elrond (feat. "Aniron) (Theme for Aragorn and Arwen ")
56wkp0dkpjimGfX17Ofihm, Divine Council, Decemba (Remix)
56jmQ1ZWXUWNmIQQZb14bJ, Divine Council, Dick in Da Dope
21HbPDkVe9QPOnsLE3oHXK, Famous Last Words, One in the Chamber
5rTGQ6XnZ4j4Oecmg7mVWy, Dimmu Borgir, Council of Wolves and Snakes
3QA66YGqHvdSthvEAhGmMH, Council, Rust to Gold
0Njh4xmjFcX3f8TO1ocdlb, The Style Council, You're The Best Thing
6z5VLY5k4v3rF66brwXIxU, Famous Last Words, Council of the Dead
4wPmw6BhkLSvL7Np3AQntT, Cosmic Council, Big Black Car
3POe70arNHrWcx7XpBkGnm, Divine Council, P. Sherman (PS42WW$)
2DWf9b143xSKlm7ZWn4nVP, Mitski, Because Dreaming Costs Money My Dear
6VKYuwheBypKvCC0LqdsmN, Otherwise, Coming for the Throne
4dQAJ9WVtzlVHeGMF58PjM, Otherwise, Darker Side of the Moon
30jx61mdxlrNrt1ei6im0w, Fearless Motivation, Win At All Costs (Motivational Speech)
2u9JZgpye3cumo6MIl9hOe, Radical Face, Everything Costs
37NqQZ11qzaq7BiMXWSBb6, Switchfoot, What It Costs
6Ee7ZCjYEfathubxT6z7pp, James Dooley, At All Costs
0ofv8YQ5mupJmiShFxCX18, Fearless Motivation, Win At All Costs - Motivational Speech
62LJXO08JM6Ma9WW5OHNUa, P.S.D., Every Damn Day
04OPVm5qCnG6AmGIpn8p8Z, Fearless Motivation, Win at All Costs (Motivational Speech)
1OOtq8tRnDM8kG2gqUPjAj, Michael Jackson, Beat It - Single Version
0Z2J91b2iTGLVTZC4fKgxf, 2Pac, Hit 'Em Up - Single Version
36xxq7VDZZsGwARsn6Clo7, Big Sean, Living Single
0faXHILILebCGnJBPU6KJJ, Breaking Benjamin, The Diary of Jane - Single Version
7oOOI85fVQvVnK5ynNMdW7, Michael Jackson, Rock with You - Single Version
1boXOL0ua7N2iCOUVI1p9F, Daniel Caesar, Japanese Denim
2V4bv1fNWfTcyRJKmej6Sj, Mike Posner, Cooler Than Me - Single Mix
2pnPe4pJtq7689i5ydzvJJ, Chuck Berry, Run Rudolph Run - Single Version
3PWKPX3YJAHBL8JozsWTMC, Loote, Your Side Of The Bed
46eu3SBuFCXWsPT39Yg3tJ, Michael Jackson, Don't Stop 'Til You Get Enough - Single Version
3cryrAQSKRLbaBBBWYmH4f, Skeletonwitch, Submit to the Suffering
3vvGCSijYe0btOPgNWEPXX, Stefano Bertozzi, Submit Your Music
3nj8nyHtKFkwrjgE0d5ToZ, William Control, Submit
2ulBB8YtOeUPC32HR14ki1, Mortiis, Submit
2fpbyFzAkEunMrlKBLvZzx, Mortiis, Submit (Flux)
0P5p6KehtFC4ih7LquAzQT, Antibalas, N.E.S.T.A - Never Ever Submit to Authority
3eK1gbutUiRafqBOfToaCA, Mortiis, Submit (Subdued)
2GYKeBe5pGPd5L9TDGvzUs, Carpathian Forest, Submit to Satan!!!
4WDEplyckhKGthUL81Ehy8, Bible Truth Music, Submit to God
3JY1unZbYuWxGWr9m6l1Wl, MonsieurFekonjo, Submit to Me
4SWWe2OYC4mqf40Gc2RSdl, Roddy Ricch, Down Below
2PpruBYCo4H7WOBJ7Q2EwM, OutKast, Hey Ya! - Radio Mix / Club Mix
7w5cxTEzp1rfV3KCy0Bd5N, Edward Sharpe & The Magnetic Zeros, Home
6bUNEbXT7HovLW6BgPCBsb, OutKast, Roses
1jFwy6IBvTI01kzh9wSSV6, Steven Goldmund, Interstatus
6dRAAG4sB71NAtVCHJep7s, Chevelle, Send the Pain Below
5z7mYFfhw6N6f23VwrokJD, OutKast, The Way You Move (feat. Sleepy Brown) - Club Mix
1wuqCUWHniGdEmOKZbQ1cg, Elevation Worship, Here Again
0wpHo9ufyiNdbnr9lIe0B8, Steven Goldmund, Enter the Unseen
5PY5NbWxkAUkVQuvIuTHkz, Elevation Worship, Hallelujah Here Below
4NzMOnvSJVNKF7nw5NkXIP, Billie Eilish, bury a friend
47Bg6IrMed1GPbxRgwH2aC, Rex Orange County, Best Friend
5v2nPcapVA5eXClN6pSKCy, Darlingside, Old Friend
0sSl9LFCzQAunHx9T1Un3O, A Boogie Wit da Hoodie, Need A Best Friend (feat. Lil Quee and Quando Rondo)
3W0Fvft7V7MtSftTrC8MSQ, A Boogie Wit da Hoodie, Friend Zone
33JcUj9qQDayKswunZP9ar, Young Thug, Best Friend
4OKf7CcYuw5H2HptkcKxcP, Queen, You're My Best Friend - Remastered 2011
5mXOdtyPOL6GEuZdCyHSsb, Devin Dawson, Asking For A Friend
3yNVfRQlUPViUh8O2V9SQn, Biz Markie, Just A Friend
4i9rpfkivlHZHDE1pRGZMO, PnB Rock, ABCD (Friend Zone)
11bD1JtSjlIgKgZG2134DZ, Snow Patrol, Chasing Cars
4alHo6RGd0D3OUbTPExTHN, The Cars, Just What I Needed
62UQgDAEzQuKDwa0Lf8wt8, Alex & Sierra, Bumper Cars
3wfujdbamR3Z46F4xav7LM, The Cars, Drive
6HZ67VImxqr8aMBEEhblzf, Gary Numan, Cars
2EDYchd8hhwAOWKGQxJoro, Sleeping At Last, Chasing Cars
0CKba2KBPP9TFbh5Nf8i4P, Rascal Flatts, Fast Cars And Freedom
1SRkKyJ2JjMZgyDWC30zKv, The Cars, My Best Friend's Girl
4LtUNqSiFZzm70a7kM8hnc, Senses Fail, Calling All Cars
6B618H5CuCdEzcVs0NKTlt, Dishwalla, Counting Blue Cars (Tell Me Your Thoughts On God)
0PTJbGxtqUdUBP9oz3xIaW, Tee Grizzley, Category Hoes
6aBwnnVbYvuBffwyneW7Cl, Twista, Yo Body
31jvCfD1qnVnjadBHTnkY1, RuPaul, Category Is… (feat. Vjuan Allure)
4B9zlmKyr1L2wYOoaSAA31, Twista, Wetter
1BlmLXZiECobtN8SI8vb3L, Dj Laz, Move Shake Drop Remix
29g6BnA5ynzOhJcCUqW0yh, RuPaul, Category Is (feat. The Cast of Rupaul's Drag Race Season 9)
1RqV6dET5SZHKl8KbxnCtB, Twista, Wetter
7e4WYg5xCNvmF1g23fQf4i, Twista, Fire
4Bh5K3esi5H11COxk5DHDH, Iamjyoungin, Category E
2rJ7P1ZtVx7lXVqARvyYBs, Twista, Yellow Light
0CrhIYKizM7cLxJVh2AocH, Brantley Gilbert, Read Me My Rights
7H05LygiPiQQE1h88P7vIV, The Lonely Island, Equal Rights
2DHDdNrGxqVfskQKZ3iTmj, deadmau5, Animal Rights
2E1IPG1MMwU8N70whuXXOs, Hank Williams Jr., I've Got Rights
2PyDqCtFcXsucZqTF4rE3i, Peter Tosh, I Am That I Am
1iY92sdYcYEsHZ6r3Bi8Z0, Jess Glynne, No Rights No Wrongs
31l6t3Jq09uywRTVGbzant, The Clash, Know Your Rights
2plNKajxMkf7memACv71aY, Bad Religion, The Profane Rights Of Man
0iHZnbbFHDO9MzHWlJI0Hb, Death From Above 1979, Romantic Rights
5PxJMuvCFAEbAGaG0J4mLr, Peter Tosh, Stepping Razor
5274I4mUMnYczyeXkGDWZN, Future, Fine China
7cy1bEJV6FCtDaYpsk8aG6, The Doobie Brothers, China Grove
5yWCq9N7kIy6DpqXnGilSG, The Lumineers, Visions of China
2OVRPlR4BsnwPY7OiIfCQn, Chris Brown, Fine China
4d87IagHd2tUKqPup408jJ, La Adictiva Banda San José de Mesillas, En la Sierra y la Ciudad (La China)
03leXL2qPlSEPZtNV4eNrV, St. Lucia, China Shop
4HXOBjwv2RnLpGG4xWOO6N, Coldplay, Princess of China
1qowUCis8gYY9KOMuy8fCi, Higher Brothers, Made In China
53xAT6jud1w0NqlBjSW4VB, China Anne McClain, What's My Name
1bki22ZoLCkqb0QIJ5PtJF, David Bowie, China Girl - 1999 Remastered Version
7jr3iPu4O4bTCVwLMbdU2i, Dua Lipa, Kiss and Make Up
3eqfEoBJPQDlUZQzOP0cly, G-Eazy, Complete
4lCv7b86sLynZbXhfScfm2, Katy Perry, Firework
455AfCsOhhLPRc68sE01D8, Katy Perry, Last Friday Night (T.G.I.F.)
5b7OgznPJJr1vHNYGyvxau, Frank Sinatra, Fly Me To The Moon (In Other Words)
4eqne0oIdt9GW2ubiliny0, Judy Garland, Have Yourself A Merry Little Christmas - "Meet Me In St. Louis" Original Cast Recording
0hI3b44C9LgnNHprOegmCW, Osborne, Complete (Lucky Rose Remix)
1oxOiOjsi7plNOZEhoPLPj, Bastille, Good Grief
55qBw1900pZKfXJ6Q9A2Lc, Katy Perry, Teenage Dream
6tS3XVuOyu10897O3ae7bi, Katy Perry, California Gurls
4bPQs0PHn4xbipzdPfn6du, Panic! At The Disco, I Write Sins Not Tragedies
1TanmIWbaUj5NVwJ3k4XPd, George Strait, Write This Down
0BteLcimTI0usYZ2L2zQaZ, Brett Young, Don’t Wanna Write This Song
59O0lOCAMdBugXQrEGR6A6, Jon Pardi, When I've Been Drinkin'
1hc31O4qhv2tnSnW1290KC, Jon Pardi, What I Can't Put Down
608R6FvRtAqf2dvgKMzebP, One Direction, I Want to Write You a Song
5dHTF27CQvA7ktMvytr0Qc, George Strait, Write This Down
3wwwa3AMKPVsN3FkvBr3T0, G Herbo, Write Your Name
0wWDNsLRUuXFGRd4NcrdrR, Francesca Battistelli, Write Your Story
0UnhE0UhBTBwtnzEXzP0it, Fifth Harmony, Write On Me
44Du2IM1bGY7dicmLfXbUs, Drake, Final Fantasy
4qqArAiTPueDxIp7cf87h7, MØ, Final Song
3MrRksHupTVEQ7YbA0FsZK, Europe, The Final Countdown
74tQaH4CxM5Rs9BzerEbHr, Nick Jonas, Introducing Me - From "Camp Rock 2: The Final Jam"
0ffz9KBdCb7oJkSK0W7bbf, Tenacious D, Beelzeboss (The Final Showdown)
3aYBjxTMvrEOP0A0UXg9ER, Linkin Park, Final Masquerade
7c5lMuvtz2gddhDyG5MjB6, Europe, The Final Countdown
74M23XQkvsKoSmQ8Colncd, Grace Grundy, Final Song
0CqCpm4LLQbHUX5ysizWJS, Asking Alexandria, The Final Episode (Let's Change Channel)
2R7858bg0GHuBBxjTyOL7N, George Michael, Careless Whisper
7wC5eZcFS1Q1BsQ35DU6H4, Billie Eilish, come out and play
03fT3OHB9KyMtGMt2zwqCT, Luke Bryan, Play It Again
75JFxkI2RXiU7L9VXzMkle, Coldplay, The Scientist
7EG4kcEw17VeFKa3f5L76Z, YoungBoy Never Broke Again, Play Wit Us
1mea3bSkSGXuIRvnydlB5b, Coldplay, Viva La Vida
7LVHVU3tWfcxj5aiPFEW4Q, Coldplay, Fix You
6RUKPb4LETWmmr3iAEQktW, The Chainsmokers, Something Just Like This
29R1IMTTbDDA3VNlk6UEW5, Jax Jones, Play
7n1940b6kHcaEewFSZXnXa, Louis The Child, Better Not (with Wafia)
3AJwUDP919kvQ9QcozQPxg, Coldplay, Yellow
3Y8XpUFQzTGSEDuApfyJV1, Maggie Rogers, Past Life
1etiUDkISHELzQGMY79ryt, Bastille, Quarter Past Midnight
68vxG1i6RSmrsY9mRdqDgG, Maggie Rogers, Burning
2CPLGREl5ahzA2WPBMkpxh, Maggie Rogers, Fallingwater
6UnCGAEmrbGIOSmGRZQ1M2, Maggie Rogers, Light On
1Dr5JexwA15wmKe7Y7maA9, BØRNS, Past Lives
4L9l5x0WuzNtyEBeqzvgPE, Maggie Rogers, Overnight
4HfLQJtVT1KiX1eVedDyTm, Maggie Rogers, Alaska
3D4uUFRoYDFHbkQlTKL2Om, Maggie Rogers, Give A Little
6PyZGb1rB7oLKCICWTmGYa, Maggie Rogers, Say It
3HFDqVk2aoM1o7MKARrW5U, Fred Hammond, Father Jesus Spirit (Live)
6sbOGldEofWsQlq1GjdHJK, Class Actress, Journal of Ardency
2LL2QtanChvgKKsNZZum5L, Frédéric Chopin, Nocturne in E-Flat Major Op. 9 No. 2
7gXWx5DBR5MfsFBzPm9zSS, Frédéric Chopin, Chopin: Ballade No. 1 in G Minor Op. 23: (Largo - Moderato - Meno mosso - Presto con fuoco)
6u7RlsDrd7TJZxXnHueuNx, Mike Birbiglia, Like Fun
2kC25y9lXVom7CvQrXCMDc, Keola Beamer, 'Imi Au Iã 'Oe
1yTsbvGdEpo4vy3Vw9FV9T, E-40, Sliding Down The Pole - feat. Too Short
1kbX1IrLH5KB88mhYEYHrN, Shiloh Dynasty, Journal Entry
088OWVKqW0SPLbv7f78SUc, Frédéric Chopin, Chopin: Mazurka in C-Sharp Minor Op. 63 No. 3
5q7R8XH71VCUg850M2ZOoo, HKFiftyOne, Why'd You Have to Go
4wCmqSrbyCgxEXROQE6vtV, Gotye, Somebody That I Used To Know - feat. Kimbra
4j6vyT56kDwYwBr8NTNmyQ, Dolly Parton, Making Plans
1XT5kxg6Tk0ukCO2vBQN4v, XTC, Making Plans For Nigel
59yRjmpE2VtyiEot3Ff9LM, Aaron Espe, Making All Things New
6XhtcSX7hXtXDPOHaVwM1X, Aaron Cole, Making History
2haqQhsi8AM7mCpYPIr5mm, WATCH THE DUCK, Making Luv To The Beat (feat. T.I. & DJ E-Feezy) - MERCE Remix
0Sg5kWoILCs2zBoIHIsDAa, Keith Urban, Making Memories Of Us
57MflfPN3ObQQAQtPUp0WF, Dire Straits, Romeo and Juliet
2O6BLVmD4xdHyKg4B1ZNeD, Cole Swindell, Making My Way to You
5HjqXQPZi27d92H5gCo1Oq, Twin Peaks, Making Breakfast
4zyrCohX5F3LfakG8yyrCI, Frankie Valli, Can't Take My Eyes Off You
2rDwdvBma1O1eLzo29p2cr, Adam Lambert, Whataya Want from Me
