16cITuCC0GPy6Zq1eluYaj, Phoenix, Entertainment
6Donz2zn7kxsRyA7g5l158, Waterparks, Blonde
62uw0iWu8jLB4cYBQxjdcm, Gang Of Four, Damaged Goods
7EJw4qOq9wtJw0FoU3GeBq, Waterparks, Lucky People
0BmT0BVnYYggf7V4NCtx2B, Adam Lambert, For Your Entertainment
10tS3AWz8aUWArbnxIrUL6, Father John Misty, Total Entertainment Forever
7MH7TkjQ4RA1vG454dciw0, The Jam, That's Entertainment
0H1OyEooZ5SzBYYdJEzxoy, Adam Lambert, If I Had You
1qRKyMsn18kuIIP25W9byL, Panic! At The Disco, The Calendar
07IBuRx9So9Vo6Q0zfEnsE, Neil Sedaka, Calendar Girl
1Pg2yx1drvE8uJhMCnIpGN, Neil Sedaka, Calendar Girl - Remastered
6aR2ZSMQdxdZRqW64EuI8I, Knuckle Puck, Calendar Days
2oYjBqFcNA07SUj62EkKpY, Bright Eyes, The Calendar Hung Itself…
6k2K7wwaVYFE1iW7p2tpSt, Cayetana, Hot Dad Calendar
3n6Ay7J2Q6hEAT1zOd1QXS, Okay Kaya, Calendar Girl
7Gpx2fNJiilvrf9Ss8qbit, Neil Sedaka, Calendar Girl
12zaaVrgaiGm67I8F5ALp9, Neil Sedaka, Calendar Girl
3YG2LwgJ7LL9X21qlvUF4B, Stars, Calendar Girl
5dPRMnwZ7CeQF4oolO8lYo, Halestorm, Sick Individual
5nV3an6fhcH96diqLnRewh, Niki & Gabi, Out From Under You
6eC1ahTGH9avMgkSRifARZ, East Forest, Water Sign
6mXGi50T0SQ5vrnTd3jc9y, Niki & Gabi, Make It Sting
1IrJaT1R3ImWmAwFDYtMG5, Doctor P, Cold Individual
5FK4ta5JOdDya9OmZTTc3K, Jack Luan, Individual
6YPRWU79U3rbxUN1Gy5SoR, East Forest, 10 Laws
4zkHJSkdUNWuddCV4OD7oh, Tito Y Su Torbellino, Mike El Individual
49RW15TMR0RL9Z8d7gGCLm, This Cold Night, Enigmatic Individual
1KsERc96bNajeEiZGnXQWu, Puzzle, Captivating Individual
5fSPbm5lcwtqwXkeQQswW8, Eric Church, Record Year
7uHO4AmKtyGa5v5fsElGoC, Dead Or Alive, You Spin Me Round (Like a Record)
5huOzlgCK7PsMSG4TFBvKY, Moon Taxi, Two High
2mXsZsJBThTaJXbNcg5QD4, Miranda Lambert, Mama's Broken Heart
2hdNya0b6Cc2YJ8IyaQIWp, Electric Light Orchestra, Livin' Thing
2ozuygJ4A6g4Ig0otuuBsG, Tee Grizzley, Set The Record Straight (feat. Chris Brown)
4vC4nKK6bk9pYEVOU4EIbA, Fall Out Boy, Favorite Record
2c5wml8wsBnPfNSbCZ574T, Filter, Take a Picture
0Hxty2K8F2DrrCXQyQVpBo, Dope, You Spin Me Round (Like A Record)
1J3w85cS3FEmoSKRu2dQJ8, Cat Power, Sea of Love
5qm0KiVKMXW1kq6VrnIhz5, Eric Johnson, Cliffs Of Dover - Instrumental
2vffK7x95PKEtSY70qwo9n, Ceramic Animal, Dreams Via Memories
6atnxgdzkrtE36xaeSCK1e, Zoé, Vía Láctea
7xXqQ7mn4VzYzqla3OIcyl, Jeff Tweedy, Via Chicago
3k3gtsfxkTAldjiDxfS807, Volumes, Edge of the Earth
2rYJ67PMtxlcPQ3t94Xa2g, Smino, Long Run
58nPDufBVhMa2bT8G59CzS, Wilco, Via Chicago
1l4Y5DxxoFrlEbWG5HDRxD, Phoenix, Via Veneto
3ByvQqDpZxWGoAJHF61wYM, Volumes, Wormholes
2VGkf2IJXOSWouDhatlH3i, Elvis Presley, My Way - Live at the Honolulu International Center
0VKkyBKCXyR99navhVRqcP, Zion & Lennox, La Player (Bandolera)
3GKL13lkM5nRc4zC1lIOrR, Big Pun, Still Not a Player (feat. Joe) - Radio Version
5PG3h38oiQLEJlOuOvIs80, Big Pun, Still Not a Player
0wG4PyMJUxcjvlQnhqfn3x, Vinny West, Too Player
5Zoswf6SbX8vm7Pam8eqlb, Junior M.A.F.I.A., Player's Anthem
1RXEb6UTxJ05RffnAWfUOE, OutKast, Player's Ball
4XiZFtOlgXYtrp88tGNnk8, Too $hort, I'm a Player - Street Version
6WCeFNVAXUtNczb7lqLiZU, Elton John, Crocodile Rock
0sqqFM4j2oTkx5ZbfZHs2J, Blueface, Choose a Player
6JdMhQybpCiM754NZDw2pm, Tinashe, Player
67iF3DdebmElASIGoebYt1, White Noise Meditation, Brown Noise - Loopable with No Fade
2bX3Cb6QE8OetYBwJKnd0o, Taylor Ray Holbrook, Southern Land
2vmDyYI5QoXPiqPhm2qN60, Jasper TX, This Barren Land
4sULmO0taLzXZFs6zyf6Yn, Andy Mineo, You Cant Stop Me
4cvUik0BhfRXJyEGtTYuut, J. Cole, Land of the Snakes
489qGxxMxFWIFgtNYFzlAz, The Killers, Land Of The Free
5eHYF98ATwMIAFYvZJi1Bt, Trippie Redd, Never Ever Land
756CJtQRFSxEx9jV4P9hpA, The Darkness, I Believe In A Thing Called Love
3lCfyDeaEYxEvJSnhv1ek3, Gary Clark Jr., This Land - Single Version
6xz04ypw5JsqiyityCASG1, Joey Bada$$, LAND OF THE FREE
2cKovq3l6OJjhVVDbVKOsr, Hugh Jackman, The Other Side
7pT6WSg4PCt4mr5ZFyUfsF, Alec Benjamin, If We Have Each Other
64BbK9SFKH2jk86U3dGj2P, Red Hot Chili Peppers, Otherside
1F7vUCER63VfNzvZKTi2pn, Brian McBride, Overture (For Other Halfs)
1G3UtySE4dLlDaDNv6rXyh, Kvngshad, Fuck The Other Side
0rRjGruFonCGOt0S5zAJNQ, Glass Animals, The Other Side Of Paradise
0EAzlhtMYxRb6wbi6KnPjC, Lauv, The Other
5b7OgznPJJr1vHNYGyvxau, Frank Sinatra, Fly Me To The Moon (In Other Words)
6ToM0uwxtPKo9CMpbPGYvM, The Doors, Break On Through (To The Other Side)
2fU2TSb3bghWYkPFuqgSkr, JID, Just Da Other Day
6FfMiOK3Ma2GNAbjbGxFVn, The Weakerthans, Plea from a Cat Named Virtute
29H6lyOfySXBLw5HAJpDFB, The Weakerthans, Reconstruction Site
2fnovdkrP33dRMtJQ0O41c, Ben Prunty, Old Site - Black Moonrise Mix
79jIauLDQffSrwtY0ostxv, The Weakerthans, One Great City!
2LYlOHvm7oAsCQIXQMjUgU, Fredo Santana, My Lil' Niggaz
2xq4jJjsjekixikbC8GnCy, Historic Site, Focus Noise
4L8GRXFdOTokQk7RBiB1KS, Built To Spill, Out Of Site
3EREpXVxdUpgHJZLuqSlFF, The Weakerthans, The Reasons
5YlCqOgTTwuaUaeTXDC6kP, Metalocalypse: Dethklok, I Tamper With The Evidence At The Murder Site of Odin
3q7yikw7bfFRLuFAZJXayr, Simon Chylinski, Crash Site
2IQB5iBapo0Y37Yc0PtIZc, Lulleaux, Contact
2M5ndhTi0zOIymTD4Ff1T8, Logic, Contact
2KHRENHQzTIQ001nlP9Gdc, Daft Punk, Contact
13vcqgMWOlvvMkCkGEsQ5a, Wicca Phase Springs Eternal, Contact
0LIU3eOAwXCZlWOiHuItkj, NIHILS, Help Our Souls (Urban Contact Radio Edit)
1bYSmvl1dGYZmj7kDuCx2G, Luttrell, Contact
50B5n3xXRQh1SnNqipFevM, ONEUS, EYE CONTACT
6mKai3TB6wtorWTX47wHUt, Deltron 3030, Positive Contact
7cz2upTFQiq0ROgFrkR1VW, Far Out, New Beginning
6o73MCFiq6VH2ipmHJEv6A, Anthony Rapp, Contact
0VhgEqMTNZwYL1ARDLLNCX, James Arthur, Can I Be Him
0ibG3XCJ32Qq9maUY4AViR, MKTO, How Can I Forget
0qxYx4F3vm1AOnfux6dDxP, Paul Simon, You Can Call Me Al
0lVYRIVjK77Z6uG2GgM8Kl, MercyMe, I Can Only Imagine
3Ti0GdlrotgwsAVBBugv0I, A Tribe Called Quest, Can I Kick It?
3ZbJMlEL4Kcme0ONRO7Slx, Marshmello, You Can Cry
2TeLIzFBe3hxkPR5FIQZut, Sam Smith, Like I Can
4sULmO0taLzXZFs6zyf6Yn, Andy Mineo, You Cant Stop Me
5ollDCofTmRZN0Bbhz4EDW, Emily Blunt, Can You Imagine That?
1isXdpzFMO6EIkgdWjV2D8, NF, Can You Hold Me
498ZVInMGDkmmNVpSWqHiZ, Florida Georgia Line, May We All
5Mw9bXG1dLNhbjofkVS2oR, Hillsong UNITED, Oceans (Where Feet May Fail)
6c20LH3R4foocWLmYyojWq, Rod Stewart, Maggie May
3t5OV1asJHmOlf23T08CLv, Tyler Childers, Lady May
5NeIONQWJ25uPylJBJiO4c, Stone Sour, Through Glass
435XaJ1Mqo5Pd7AwRE7nrF, Gregory Alan Isakov, Virginia May
7LAJWSKK8JMIZAcblgUMS6, Enya, May It Be
49rcSzMayJhIwGf0CJCaxJ, Metallica, Wherever I May Roam
0VaIsQoIQY10uxBrOyZ5cQ, Francis and the Lights, May I Have This Dance (Remix) [feat. Chance the Rapper]
3CJZVGg64NKFXU4wYbKzXs, Hillsong UNITED, Oceans (Where Feet May Fail) - Radio Version
7dt6x5M1jzdTEt8oCbisTK, Post Malone, Better Now
7hQJA50XrCWABAu5v6QZ4i, Queen, Don't Stop Me Now - Remastered
14sOS5L36385FJ3OL8hew4, Kygo, Happy Now
09IOPhEh1OMe0HD9b36FJk, Post Malone, Over Now
4keoy2fqgwGnbWlm3ZVZFa, Zedd, Happy Now
6nO3tr47nr2P7f3hXb8JIo, NAV, Champion (feat. Travis Scott)
05nbZ1xxVNwUTcGwLbp7CN, NAV, Myself
6j97zG4DDrh3oUa6rZbFOs, Tory Lanez, FeRRis WhEEL (feat. Trippie Redd)
7i2DJ88J7jQ8K7zqFX2fW8, Halsey, Now Or Never
790MhTXPFrYkrqCKvpg4t1, NAV, Wanted You (feat. Lil Uzi Vert)
3dCZm5HrG0jIXAHfNkg2H0, Jordan Davis, Take It From Me
4LiMQ6G9n84rDUBs9wtwz6, Jordan Davis, Singles You Up
7yCPwWs66K8Ba5lFuU2bcx, blink-182, All The Small Things
1fnULsZuORnAgCFFbM8nTZ, Shinedown, State Of My Head
5JZcX7TTLx4l0xFIXJ3DBt, blink-182, What's My Age Again?
7CoMBpPTwQi2wPT0U0Nr9b, Novo Amor, State Lines
1qRsC0QNSTXiTvHeeUlN5k, Kid Bloom, Different State of Mind
58cvckETahSOG74RP5WE99, Logic, State Of Emergency
5zwz05jkQVT68CjUpPwFZe, Nas, N.Y. State of Mind
0trHOzAhNpGCsGBEu7dOJo, Nas, N.Y. State of Mind
25sgk305KZfyuqVBQIahim, Ava Max, Sweet but Psycho
465mhRDuwxjrJ61UrvRvrZ, Future, Krazy but True
1HOUzEsetdIPSpAgRPhZQt, Trey Songz, Nobody Else But You
42sQwZ9agZFDd9cQfKfZSb, Jerrod Niemann, But I Do
1PfUKiMDKIlPEF9FfdJawc, Lana Del Rey, hope is a dangerous thing for a woman like me to have - but I have it
1Ug98CRiQYu7wiSym4uLY4, Metallica, Sad But True
77TT8Xvx637TpzV8kKGkUw, David Guetta, Titanium (feat. Sia)
2wvMC5EyaaYQwBfiwwY2xE, Joe Walsh, Life's Been Good
2xRYnHQdLD9ketvC01UYYT, Sevyn Streeter, It Won't Stop (feat. Chris Brown)
2ZqTtndqAZDRAWw2vgZwQK, Panic! At The Disco, But It's Better If You Do
3KkXRkHbMCARz0aVfEt68P, Post Malone, Sunflower - Spider-Man: Into the Spider-Verse
2meEiZKWkiN28gITzFwQo5, Ariana Grande, Into You
4Uy3kNxW2kB8AEoXljEcth, Nicki Minaj, Familia (with Anuel Aa feat. Bantu) - Spider-Man: Into the Spider-Verse
6rz0dTA0PdhXImFV5EjM0w, Juice WRLD, Hide (feat. Seezyn)
1HL3yEnYq8LEyFQ3QegA5V, Dave Matthews Band, Crash into Me
1yjY7rpaAQvKwpdUliHx0d, Paramore, Still Into You
1LzNfuep1bnAUR9skqdHCK, Mazzy Star, Fade Into You
3lh3iiiJeiBXHSZw6u0kh6, Van Morrison, Into The Mystic
3TgMcrV32NUKjEG2ujn9eh, The 1975, It's Not Living (If It's Not With You)
3vWzyGTu6Ovo1GdrcJqH6e, Lil Wayne, Scared of the Dark (feat. XXXTENTACION)
7ccI9cStQbQdystvc6TvxD, Queen, We Are The Champions - Remastered 2011
54flyrjcdnQdco7300avMJ, Queen, We Will Rock You - Remastered
2lwwrWVKdf3LR9lbbhnr6R, Modest Mouse, Float On
7FxzgizJRGTQ3fxUqfvljg, Leon Bridges, Bad Bad News
4kL66iksPrNaqzKYlzDgoa, Louis The Child, Breaking News (with RAYE)
2olVm1lHicpveMAo4AUDRB, Huey Lewis & The News, The Power Of Love
1dXCXb006YbPSAajh6qhaF, Ocean Park Standoff, Good News
3x9ITe8AC3Iy0btOEdcV6C, MercyMe, Best News Ever
0KOE1hat4SIer491XKk4Pa, Sam Cooke, A Change Is Gonna Come
3QqTmV1zpTNEAMviQFUFkW, Mandisa, Good News
27356GVuMPFWiJSZCragoM, Ariana Grande, make up
7jr3iPu4O4bTCVwLMbdU2i, Dua Lipa, Kiss and Make Up
2ZxTjs4EdJl4Y9YByIiNoo, Jason Aldean, You Make It Easy
44nlOJLjLqwNgYcT277V25, Bass Santana, Make Eem Run!
4o6BgsqLIBViaGVbx5rbRk, Daryl Hall & John Oates, You Make My Dreams
3I7krC8kr0gFR7P6vInR1I, Billy Currington, Do I Make You Wanna
6P7tTFzn6oNa0GL8w8oazE, Adele, Make You Feel My Love
0AYbVoeF03NYhM0fvKjAuU, Jimmie Allen, Make Me Want To
7C6JnGZRj0HMIF06rlz9Mb, Old Dominion, Make It Sweet
2EhJijFUs0WUmNClDBpYJq, Juice WRLD, Make It Back
5FEXPoPnzueFJQCPRIrC3c, Kid Cudi, Day 'N' Nite (nightmare)
14kYOiFVPb7E7NfFbqhdln, Ariana Grande, goodnight n go
5YP6yKgGGsXKukqxXypVAf, Future, F&N
4VMiNOpnjRwSCwmHaUfOMM, Future, Realer N Realer
5itOtNx0WxtJmi1TQ3RuRd, Calvin Harris, Giant (with Rag'n'Bone Man)
19gEmPjfqSZT0ulDRfjl0m, Bobby Shmurda, Hot N*gga
33tNYw9oMtSkGe27NpgS64, Quavo, WORKIN ME
5DbIxurVkaHTfrS1BsMj8i, Kevin Gates, Right Game Wrong N****
5NIPsWpDjJTFBoPxCUUeXp, Guns N' Roses, Welcome To The Jungle
4MhTFsyqIJnjsOweVcU8ug, Guns N' Roses, Sweet Child O' Mine
3woRy7uxzl1lO2XO99oHsN, Chance the Rapper, The Man Who Has Everything
4RnfMhMUMqHlrn4V6A3KfS, Run The Jewels, Legend Has It
43GS3mtezoIFiuIZCLLiDY, Poison, Every Rose Has Its Thorn - Remastered 2003
76N7FdzCI9OsiUnzJVLY2m, Adele, Rumour Has It
1mGO8rwCE9zk7H06OxcU5m, Christopher Jackson, History Has Its Eyes on You
6PSBdwyrcpSAIikYqaW2LB, Gadiel, Has Cambiado
4NAmRvqSITAAzKWnC8yRq3, Taylor Swift, Everything Has Changed
7gdwoOmi258QJq0hmQ4hto, Taylor Swift, Everything Has Changed
6W49z468BT75GsO2tCcBtq, The Barr Brothers, Even the Darkness Has Arms
1H7gMYGykdtwZOV6s1N0by, The Beatles, Norwegian Wood (This Bird Has Flown) - Remastered 2009
2t8yVaLvJ0RenpXUIAC52d, 21 Savage, a lot
2FUNBaa5DwItJtYEBgAblU, 21 Savage, monster
4paAidoE8VAemwU4jgCc6l, 21 Savage, all my friends
0hPLZrnDgtKxrym1BHjDhd, 21 Savage, can't leave without it
7tGEAA1f8MydT7eVbbO9Zy, Billie Eilish, WHEN I WAS OLDER - Music Inspired By The Film ROMA
0nJW01T7XtvILxQgC5J7Wh, Bruno Mars, When I Was Your Man
2wOXxtHZgRkkrkEbKLzzqs, 21 Savage, 1.5
2qOm7ukLyHUXWyR4ZWLwxA, Ice Cube, It Was A Good Day
2ANLarE8yHVsLWW21nj79M, Lil Uzi Vert, You Was Right
50a8bKqlwDEqeiEknrzkTO, 21 Savage, ball w/o you
3pndPhlQWjuSoXhcIIdBjv, Russ, What They Want
4O1uCappFiU3bisYUdUBWy, YoungBoy Never Broke Again, I Am Who They Say I Am (feat. Kevin Gates and Quando Rondo)
3wImXdE4bliIVSEl3lVue1, THEY., What I Know Now (feat. Wiz Khalifa)
4T5Z4mbTe7kuGqgLpaRtTh, Jason Aldean, Any Ol' Barstool
72C7aUQECOhNtnD0AC36ua, One Direction, They Don't Know About Us
0247StOpd3AkeBQzANX4Zf, Band Aid, Do They Know It's Christmas? - 1984 Version
68dd9CEzAUc4zeukKzMJP5, THEY., Broken (feat. Jessie Reyez)
1w1kzejjmiMhdWAOecgo4l, Ariana Grande, They Don't Know
1rtv2GCn8xGsJb3q2a6b96, Hammock, Maybe They Will Sing for Us Tomorrow
0zqmyB1prgGGiOS10sjH8A, Generationals, When They Fight They Fight
3WRIaWsws011vHMd9uzPjG, Future, First Off (feat. Travis Scott)
3muBQDekYAg7jm6hDu6R0Z, Tee Grizzley, First Day Out
5JAi8xj5HavxosXBqj8Ggu, Wiz Khalifa, First Or Last
1ikrs0fSU2kQcUptynO1zM, Wiz Khalifa, First Or Last
3omXshBamrREltcf24gYDC, Cold War Kids, First
1fJFuvU2ldmeAm5nFIHcPP, blink-182, First Date
1o6YK7phnXgsljfWSQQfWc, James TW, When You Love Someone
4NZrZgrRoR4GwR7flWOXRI, Two Feet, Go Fuck Yourself
0LG2cFomCi8Fb664Lvr3Nu, Darius Rucker, For The First Time
2Gl0FzuLxflY6nPifJp5Dr, Kygo, First Time
2t8yVaLvJ0RenpXUIAC52d, 21 Savage, a lot
75ZvA4QfFiZvzhj2xkaWAh, Post Malone, I Fall Apart
58q2HKrzhC3ozto2nDdN4z, Cardi B, I Like It
2FUNBaa5DwItJtYEBgAblU, 21 Savage, monster
3QLjDkgLh9AOEHlhQtDuhs, Drake, Best I Ever Had
1wjzFQodRWrPcQ0AnYnvQ9, Lauv, I Like Me Better
7eBqSVxrzQZtK2mmgRG6lC, YNW Melly, Murder On My Mind
4paAidoE8VAemwU4jgCc6l, 21 Savage, all my friends
4S8d14HvHb70ImctNgVzQQ, Kanye West, I Love It (& Lil Pump)
4xkOaSrkexMciUUogZKVTS, Eminem, 'Till I Collapse
2JvzF1RMd7lE3KmFlsyZD8, J. Cole, MIDDLE CHILD
4at3d5QWnlibMVN75ECDrp, 6LACK, Pretty Little Fears (feat. J. Cole)
1BuZAIO8WZpavWVbbq3Lci, Rae Sremmurd, Powerglide (feat. Juicy J) - From SR3MM
0YAQnYt2oB8OdoaeqnHyTI, Bas, Tribe (with J. Cole)
58q2HKrzhC3ozto2nDdN4z, Cardi B, I Like It
3JAeYOjyJodI4PRs44lx2l, JID, Off Deez (with J. Cole)
62vpWI1CHwFy7tMIcSStl8, J. Cole, No Role Modelz
7yotKA30dwTKNEGomV9ZsI, J. Cole, KOD
1CVAENDG5VY05pEHh0ViXL, Ari Lennox, Shea Butter Baby (with J. Cole)
6Ius4TC0L3cN74HT7ENE6e, J. Cole, Wet Dreamz
7iMDaY1LnASwCk2uUpMtii, Young Thug, High (feat. Elton John)
0V6imIPZVXJEtl2umdNILO, Ella Mai, Everything (feat. John Legend)
3bH4HzoZZFq8UpZmI2AMgV, John Mayer, New Light
3U4isOIWM3VvDubwSI3y7a, John Legend, All of Me
2xYlyywNgefLCRDG8hlxZq, John Denver, Take Me Home Country Roads - Rerecorded
3gdewACMIVMEWVbyb8O9sY, Elton John, Rocket Man (I Think It's Going To Be A Long Long Time)
2TVxnKdb3tqe1nhQWwwZCO, Elton John, Tiny Dancer
2jdAk8ATWIL3dwT47XpRfu, John Mayer, Slow Dancing in a Burning Room
38zsOOcu31XbbYj9BIPUF1, Elton John, Your Song
72f7jNxopSGvbx3M35i3Zl, Keith Urban, John Cougar John Deere John 3:16
1d1Ar7WMzT7WaXqGG2IRB9, DJ Godfather, New Forums
6u7gc7o7A7Rfnm7g2giOnd, Lucee, Forums
6Cz6RkdZV1eRZK9vqTtkmz, iAudioguide, Imperial Forums
53y5XHULf9GlDiGzG3jgrN, Dj Kontrolar, Killed Forums - Original Mix
2bQlgbtkWuMajfUZCwSHTu, Dj Kontrolar, Killed Forums
1KifQuInrPnaDHxD6nhN1Z, R-ODD, Forums & Hands
2qwYxpQDPDtpN8EKVe8Fk9, iAudioguide, Imperial Forums - Rome
4IUWSddTFoN45npBTMLWSx, Various Artists, Forums - Good Or Bad?
0iaLR0iCoSKGTOBHCBTssc, Sin, Virtual Forums (Bonus Track)
2k5W18I24iIAsjqxMxDC5e, Jack Blacknet, The Birth of Networks - Forums
29GuoJqjg7aMxUmEO3XLEp, Françoise Hardy, Comment te dire adieu - It Hurts to Say Goodbye
0zNMwL1RFQWkcYUPGTUFhs, Françoise Hardy, Suzanne
2J80ZCQRp6yBW2WTLnHTkW, Eric Nam, No Comment
3I4NpFeOGL3ETilM1jcFmd, Infected Mushroom, Suliman - No Comment Remix
206sbPOnuqEUQukXdVzzzM, Ground Zero, No Comment
28n9lq0EqQU2H56O5KAZng, Thriftworks, Comment Allez-Vouz (feat. Boom Forest)
1eXv38jXukTghRTXP60E5J, D'banj, Comment Ca Va
1YweKChtEj3IEFosAy1cY8, Jacques Dutronc, Comment elles dorment - Remastered
1BA19ZQX2aT7m5lA5hBKNH, Charles Wright & The Watts 103rd Street Rhythm Band, Comment (If All Men Are Truly Brothers) - Remastered Version
3Knc5zT24bvPZdhmZQsOC1, Françoise Hardy, L'Anamour
5jUXYkjrCkkhnMMJPTgSqN, HI-FI CAMP, Cabin Sound
5tMViyamkwQmHjMm1OajDi, Dylan Schneider, How Does It Sound
1Cj2vqUwlJVG27gJrun92y, Disturbed, The Sound Of Silence
5S5rw0WLVCAux5B5bWCehK, Rascal Flatts, I Like The Sound Of That
6Z8R6UsFuGXGtiIxiD8ISb, Capital Cities, Safe And Sound
575DZcL4PtBm3qoFdilkq8, Tmsoft’s White Noise Sleep Sounds, Box Fan Sound
2EoOZnxNgtmZaD8uUmz2nD, Soundgarden, Black Hole Sun
0l1KG1a65GW39PsIEn1H5h, The Rain Library, White Noise Rain Sound
2VWBdFsDJVGlRTdz4PvYwy, Luke Combs, Dive - Recorded At Sound Stage Nashville
316r1KLN0bcmpr7TZcMCXT, The 1975, The Sound
3Ypnlj9KYSif4Elk7EeHgt, Silk, Meeting In My Bedroom
6zpPAVisAb7RQA6gqJKiyI, Silk, Meeting In My Bed Room
5CQHf6LdOYDls2k51aSdMp, The National, Secret Meeting
1iJdIZU5Ffgixa92wrcZZC, Animal Collective, Man Of Oil
0lmT9W6HJBuHTTLAx55CEI, Jeremy Soule, A Chance Meeting
7DFj4U25OOZdVyddp3SMp5, Manwolves, Georgia Peach
5f4tPWBqtRCAVUSh7A4UxL, Zen Hanami, Meeting Spirits
2Yx4COj98jyZ46IGyqQeCE, Cast - The Nightmare Before Christmas, Town Meeting Song
7mL0DJOgIJ9Z4b0NHVtTZe, Klymaxx, Meeting In The Ladies Room
3MOI5WPXHKppLAx9JcjigT, The Last Shadow Puppets, The Meeting Place
3Q3myFA7q4Op95DOpHplaY, blackbear, do re mi
4xh7W7tlNMIczFhupCPniY, Fleetwood Mac, Go Your Own Way - 2004 Remaster For Digital; 2004 Remaster
1nMYtxDrONcoGnKRvxTwPv, blackbear, i miss the old u
13JyykwyYQ3T5QxxL34ukQ, blackbear, chateau
4qhDA6s0MkD5XpDqGLHIEY, Imagine Dragons, Digital
7F9vK8hNFMml4GtHsaXui6, Louis Tomlinson, Back to You (feat. Bebe Rexha & Digital Farm Animals)
6vo5a9n1HWYroioj7k6gZS, Harold Budd, Foreshadowed - 2005 Digital Remaster
5yFSF6qQA1rcLsQRnBsZgb, Alan Walker, All Falls Down (feat. Juliander)
4voEoczU7Ijborps9XF1n3, 2Pac, I Get Around
0GR7iJLhj80KD5LkA14ZRn, Drake, Digital Dash
2cGJxXXIBrxMhk2fWUJTLs, Grits, Ooh Ahh (My Life Be Like) (feat. Toby Mac)
5jqNQZBwbZWQXPWfo0ygZF, Lana Del Rey, Art Deco
0d0jsoba88SpOoFxCxA2rZ, Kendrick Lamar, The Art of Peer Pressure
3jxzbVpCegxDaWXufQWYOd, Citipointe Live, How Great Thou Art
1LxKKYsJNPeBdOwdudsJzv, Yo Gotti, Down In the DM
0bUkXqilY3UuRPTTVmiHkF, Switchfoot, THE HARDEST ART
7mhk9WyqZZzvTTCQKfh2iV, Yo Gotti, Law
3XqdYTHbYWw2haLim9Kwfc, Young the Giant, Art Exhibit
17eu2pSgSUpIG1GFWBnODv, Grimes, Kill V. Maim
2M4wcPQ5WBwLCCfX1GUTCu, Shane & Shane, How Great Thou Art (Live)
6GSkLS2y4ZnnZsuRAj975K, Marshmello, Project Dreams
40oKW22ZNNkEdZLJTScaQI, Kodak Black, Roll In Peace (feat. XXXTENTACION)
4DTpngLjoHj5gFxEZFeD3J, Kodak Black, Codeine Dreaming (feat. Lil Wayne)
1WIZiOuNO3woKfdlSK2gNn, Kodak Black, Transportin'
0ZAiqymvbQUZAh9y6ZT3Rm, EDEN, XO
3DlgDXIYtnWtJKiB8bZQMv, Saba, Photosynthesis
1SaEt8dwTuLDzenUu5BqI6, Aventura, Un Beso
6G4U9avyBNEfP0fAIduev3, Aventura, Ella Y Yo - Featuring Don Omar
3OXpdrHLT4IqM76RajgM6Q, EDEN, drugs
4GVIKZW6a4q0we4Ebc1FdP, The Noise Project, Big Fan Dulled
6Dc2tCivms1s2X9myWe4ni, Rodrigo Amarante, Tuyo (Narcos Theme) - A Netflix Original Series Soundtrack
5qkAxtjTFSXDbfB37LWQNH, Machine Gun Kelly, World Series
1GkAK6lX1NKI51YmMy7oR0, Max Richter, A Lamenting Song
0P6RjFd2HgG2AXJadQuGfE, ZHU, Working For It - Bonus Track
6mLfR7fHVDcCKpLwGLWCWw, Kid Ink, F With U (feat. Ty Dolla $ign)
6g2BiiVQqY5v1S4HIrM54F, Rodrigo Amarante, Tuyo (Narcos Theme) [Extended Version] - A Netflix Original Series Soundtrack
3mVrRcYW3i21oY2SoJhlCM, Max Richter, the end of all our exploring
40zj6W7wVqeNkfXjSmFQqx, Baby Sweet Dream, Baby White Noise Series - Pure White Noise
77O9eTcQpYwCnANBQHjGDQ, Max Richter, Lamentation For A Lost Life
6oL99CBEXTL8vZ5PpmknXk, Max Richter, Departure (Home)
0rsDhujEJ73Q7I9bvEljAZ, Shannon Purser, Sunflower - Movie Version
6pxElwU80zhjbCC77Vn8EI, Tom Misch, Movie
0V8FYVlBFuXXTIvRnMbZyS, Miley Cyrus, The Climb
56WjtnIYDizFHsceYrZEvE, Queen, We Will Rock You - Movie Mix
1hGB1XK88qDUpGpNSyzEqm, Blueface, Movie Scenes
4nI8e3fy1hHvhCvJURv5JI, Meryl Streep, Mamma Mia - From 'Mamma Mia!' Original Motion Picture Soundtrack
6P4XyViJkq9QGEHtzfMIrH, Amanda Seyfried, Honey Honey - From 'Mamma Mia!' Original Motion Picture Soundtrack
74wySERHHxB8Ul9A0CNBla, Dominic Cooper, Lay All Your Love On Me - From 'Mamma Mia!' Original Motion Picture Soundtrack
05AOPvoV28DuSyi29dJpEo, j'san, Movie Scene
33trZRsRCHDPemnACBcLJJ, Meryl Streep, Dancing Queen - From 'Mamma Mia!' Original Motion Picture Soundtrack
58zsLZPvfflaiIbNWoA22O, Rag'n'Bone Man, Human
2BOqDYLOJBiMOXShCV1neZ, Calum Scott, Dancing On My Own
0SuLAslEMFZAXf0SwY7syi, Jon Bellion, All Time Low
69vToJ9BMbbLlFZo7k7A7B, Calum Scott, You Are The Reason
1zVhMuH7agsRe6XkljIY4U, Christina Perri, human
1sTsuZTdANkiFd7T34H3nb, The Killers, Human
1x80xTzSL7pok3M5JC3oJz, Christina Perri, human
1euszbbvkUzQzIhZUWFmXG, Highly Suspect, My Name Is Human
2yUIjUh9zQCahXZ9dS7D5X, dodie, Human
2MKIadkPrRqaivpyn6cnI0, dodie, Monster
577YBGuskWkVDCxZrLRB4v, Lil Baby, Pure Cocaine
52i143Ph5c3RQaQFBXWix1, Lil Baby, Word On The Street
1Szfm2XAx3Kgl55dyl8sTU, Lil Baby, Time (feat. Meek Mill)
4F6yN5FsFW10Ucx7cLCzBh, Lil Baby, Ready (feat. Gunna)
39RWYLt6hgk9BbhkDgaHW9, Lil Baby, Crush A Lot
7cW1wHpSLYgKWzoWlOCPFJ, Lil Baby, Global
2WqTKOAUmv7hz9ZzGnXHrY, Lil Baby, Realist In It (feat. Gucci Mane & Offset)
7Ar4G7Ci11gpt6sfH9Cgz5, The Doobie Brothers, Listen To The Music
5Y77SQxEr1eiofPeUTPHxM, Lloyd, You
2mGsE1qEjglIN1Ai4egOBO, Joey Trap, Sesame Street (Extended Version)
2YMhrXQYKkm4kXLcXKKd5z, Dustin Lynch, Small Town Boy
7vgTNTaEz3CsBZ1N4YQalM, Kanye West, Ghost Town
7K0lR5Ngf5jkOWt1g6ut6l, Jason Aldean, Girl Like You
66OqnHUVdcpj1RJJh6ady9, Florida Georgia Line, Small Town
3L5cSHbf7oBWubuCwJbUGt, Dylan Scott, Nothing To Do Town
0qvzXomUDJVaUboy2wMfiS, Niall Horan, This Town
2dwoqUYTy6SOy1dFqcTndC, Jason Aldean, Drowns The Whiskey (feat. Miranda Lambert)
0cXRafInOlc1QH519RXltN, Conan Gray, Idle Town
6EGAfJaLUFzhS4zRBIEQ2J, Jason Aldean, You Make It Easy
7aftSOGSOpSoIlVAQVBb71, Sam Hunt, Break Up In A Small Town
3wjLaodSMCuYwiJBeRKNQ4, living jax, Big Result
2VCUj9lllutAGr3eHaZj5p, Crass, End Result
6kJBsw2xn3g1uRlPKGcbob, Capcom Sound Team, Total Result (トータルリザルト)
6qZJOJzRiNp07Mev4hVHuq, umru, heat death
22H5RT7kKzfm8P8NU4VDYz, Mitchell Blueton, Single Result
139EeAeA9C4DRW3JrbOoXA, Pigeon Dandelar, Stretcher Result
4n9TwryLI8dc7JA7zCS7He, umru, popular
6MlcaZsTbTfe6DKC9WXMQf, umru, chemistry
1g8cBYa0gCPDFatq8zbR2I, Garoad, Final Result
2Rv6buMOxsqUpma6xBlxQ5, umru, linkrot
5cf1ZfI16kHp3S1ySpQ36G, Grizzly Bear, Ready Able
7scP7MITYHJ1cYr1yToNHO, Hippie Sabotage, Able to See Me
4afLrLDQKTxn1dFc9ejnLd, Chinko Ekun, Able God
4fFx9gzhfhSNu71e4tveEN, HELLYEAH, Love Falls
29rBJWizgnVht4qXpHyDxh, Disclosure, Willing & Able
5yQWk2KWtPa4p7p4rCMr2A, Current Swell, Young and Able
2fd0mcaBc5sWUwMZh71Jan, Hillsong Kids Jr., God Is Able
537bauuRZw1QMo3Ya4vZrz, Kirk Franklin, He's Able
2ZQD6TKvFnnVVNMYb585NH, The Revivalists, When I'm Able
4Ri3xyzxDHEdYwEPvfp5kP, Hillsong Chapel, God Is Able - Live
3F42FHouOY59SnSsyD2TAX, Lil Peep, U Said
41WTP0gosjYD74B06uS2tL, Michael Schulte, You Said You'd Grow Old With Me
5ArQzSBevAdXTxRY6Ulhbq, Lukas Graham, Mama Said
16MVSD0mGI4RMQT83Qzm69, Taylor Swift, Should've Said No
4EHWldZTas5KUyFtT0rQlY, Matt Maher, Lord I Need You
4kqxy0SvQ2N34nOJ9ggfMu, Rihanna, Yeah I Said It
2oL0HIuo0cxIycDtJWbpuN, ILLENIUM, Where'd U Go
6UXBFqtZdXzX4bkpqOPsDi, Ella Vos, Rearrange
6C7ZgThn6Yan5MTZdAEEFw, LL Cool J, Mama Said Knock You Out
6BDLcvvtyJD2vnXRDi1IjQ, Seven Lions, Rush Over Me
4VXIryQMWpIdGgYR4TrjT1, Juice WRLD, All Girls Are The Same
7BqBn9nzAq8spo5e7cZ0dJ, Bruno Mars, Just the Way You Are
69vToJ9BMbbLlFZo7k7A7B, Calum Scott, You Are The Reason
155EsNGoXo7XSVF84oTPam, ZAYN, There You Are
57nOpVSc3j9o03Cr928ZM4, XXXTENTACION, what are you so afraid of
4P5KoWXOxwuobLmHXLMobV, Nirvana, Come As You Are
75ls0gurX68lUmMjE7QcsE, Jeremy Zucker, all the kids are depressed
79LAFAkR1ATb4iIQvZuCL0, Luke Bryan, Most People Are Good
1YLJVmuzeM2YSUkCCaTNUB, Florence + The Machine, Dog Days Are Over
1TfqLAPs4K3s2rJMoCokcS, Eurythmics, Sweet Dreams (Are Made of This) - Remastered
7COXchtUOMd6uIT6HvmRaI, Lauv, i'm so tired...
7FjZU7XFs7P9jHI9Z0yRhK, NOTD, So Close
1v24T2ug4TlssYZvI3aL4O, Drake, Lust for Life
4XTXamS1g4g93jPxyuFJJ6, Drake, Brand New
6MlGqWzDiLkZ0vmAEsisEk, Drake, The Calm
6NwhtCYkfwWlcR62Ac4E7y, Drake, Successful (feat. Trey Songz & Lil Wayne)
7mPoCVGP752A5DtHf1SKkM, Drake, Say What's Real
3XLSlQLJf3Ut0zvMUxnF1h, Drake, Houstatlantavegas
3SnXwQUrvSacFziUYXTNKY, Drake, Congratulations
524wvipGqxPKYWxkjf9y46, Drake, Little Bit (feat. Lykke Li)
7zFXmv6vqI4qOt4yGf3jYZ, Daniel Caesar, Get You (feat. Kali Uchis)
1XRgIKC5TPwo7nWGyKqgG0, Gucci Mane, I Get The Bag (feat. Migos)
0kCBorRrKZkSztd9m0QI3r, Young Thug, Chanel (Go Get It) [feat. Gunna & Lil Baby]
3m2aDCqn8eT5ElXDUiboGU, Lil Yachty, Get Dripped (feat. Playboi Carti)
1Ser4X0TKttOvo8bgdytTP, Rae Sremmurd, Come Get Her
39oeKRgsLeynDIbWuXyA47, Joji, CAN'T GET OVER YOU (feat. Clams Casino)
6n6OQfBpCgzF9oEg8zhBN7, Kenny Chesney, Get Along
7u6DMPznGbpziuEgCE0JGQ, Ariana Grande, get well soon
4ZLzoOkj0MPWrTLvooIuaa, Kina, Get You The Moon (feat. Snøw)
0r2Bul2NuCViraT2zX1l5j, Ying Yang Twins, Get Low
54flyrjcdnQdco7300avMJ, Queen, We Will Rock You - Remastered
51rXHuKN8Loc4sUlKPODgH, Jay Rock, King's Dead (with Kendrick Lamar Future & James Blake)
1lL7Sj9AitQT7YWXs6obEq, Meek Mill, Dangerous (feat. Jeremih and PnB Rock)
2xbI8Vmyv3TkpTdywpPyNw, PnB Rock, Selfish
2qxaR31Te4xDR2yO6LqM8z, Hailee Steinfeld, Rock Bottom
5de7ci7TFqbQ1PFgKAD7MR, PnB Rock, Horses (with PnB Rock Kodak Black & A Boogie Wit da Hoodie)
3mUk1wiSBpiuK4oSSyDmTQ, A Boogie Wit da Hoodie, Uptown / Bustdown (feat. PnB Rock and Lil Durk)
7oOOI85fVQvVnK5ynNMdW7, Michael Jackson, Rock with You - Single Version
7vQbuQcyTflfCIOu3Uzzya, Bobby Helms, Jingle Bell Rock
1AWQoqb9bSvzTjaLralEkT, Justin Timberlake, Rock Your Body
6RUKPb4LETWmmr3iAEQktW, The Chainsmokers, Something Just Like This
7BqBn9nzAq8spo5e7cZ0dJ, Bruno Mars, Just the Way You Are
0uH6JssU7mWkTT9mqeqEvL, A Boogie Wit da Hoodie, Just Like Me (feat. Young Thug)
1dNIEtp7AY3oDAKCGg2XkH, The Chainsmokers, Something Just Like This
6HkjpGIOHv4y0IBAxUbE5z, Lady Gaga, Just Dance
0v3BMLcwUmAwyqJaf5997o, Sigala, Just Got Paid
